ID,Text,Author,Author Handle,Timestamp,URL,Like Count,Retweet Count,Reply Count,Has Media,Content Type,Engagement Score,Priority Score,Sentiment,Language,Topics,Hashtags,Mentions,Thread Start,Thread Part,Thread Length,Thread Position,Thread Context,Thread Engagement,Thread Complexity,Content Hash,Relevance Score,Quality Score,Engagement Potential,Learning Value,Knowledge Category,Key Insights,Target Audience,Information Type,Content Value,Bookmark Context,Readability Score,Extraction Confidence,Actionable,Discussion Worthy,Reference Worthy,Processed At
1943799049318281607,"New study just came out showing that monthly psilocybin use extended mouse lifespan by up to 60%. Results showed less oxidative stress, longer telomeres, and better mitochondria. Psilocybin might be the most misunderstood anti-aging molecule on the planet.","Paul F. Austin","PaulAustin3w·Jul 12",2025-07-11T22:26:22.000Z,https://twitter.com/PaulAustin3w·Jul 12/status/1943799049318281607,853,113,36,No,Science,0.9999999999999999,30,positive,es,"","","",No,No,1,1,standalone,0.5,low,bb4609cd79d65631,0.5,0.76,0.7,0.5,General,"Content analysis required",general,informative,high,General knowledge and information,0.81,0.8,No,Yes,No,2025-08-25T14:28:20.148Z
1943399617380651455,"Introducing Trinity-1, the first interactive gaussian avatar, available in preview via our API today. Priced at less than 1 cent per minute, we are making interactive avatars finally viable for real world use cases. Try our demo and create your own gaussian avatar.","Simli","simli_ai·Jul 11",2025-07-10T19:59:10.000Z,https://twitter.com/simli_ai·Jul 11/status/1943399617380651455,395,56,44,Yes,AI/ML,0.9999999999999999,30,neutral,es,"AI","","",No,No,1,1,standalone,0.5,low,7c187a9fd3e5601f,0.8,0.86,0.5,0.8,Technology,"Content analysis required",general,informative,high,AI/ML knowledge and insights,0.785,0.8,No,No,No,2025-08-25T14:28:20.661Z
1942817222767878391,"As part of my assignment, I was tasked with designing a high-density data grid for an SEO platform. During development, our analysis of Google Analytics data revealed that the majority of our users access the platform on 13-inch display laptops. This insight necessitated","virgil pana","virgil_pana·Jul 9",2025-07-09T05:24:56.000Z,https://twitter.com/virgil_pana·Jul 9/status/1942817222767878391,508,23,31,Yes,General,0.9999999999999999,30,positive,es,"Data Analytics","","",No,No,1,1,standalone,0.5,low,fd34d59a54ce5c63,0.5,0.86,0.7,0.5,General,"Content analysis required",general,informative,high,General knowledge and information,0.785,0.8,No,Yes,No,2025-08-25T14:28:21.276Z
1942880967393423849,"Absolutely love how MJ Video can introduce new elements so naturally. The way the horse and servant are added into the scene feels seamless! Also using the Zoom Out Quick / Slow token makes it super convenient to create that kind of effect.","Howard Chen ✦","hc_dsn·Jul 9",2025-07-09T09:38:14.000Z,https://twitter.com/hc_dsn·Jul 9/status/1942880967393423849,403,32,18,Yes,General,0.9999999999999999,30,positive,es,"Machine Learning","","",No,No,1,1,standalone,0.5,low,93a48afabb72d07d,0.8,0.86,0.7,0.8,Technology,"Content analysis required",general,informative,high,AI/ML knowledge and insights,0.785,0.8,No,Yes,No,2025-08-25T14:28:21.430Z
1942634521792504098,"how to do this, easy mode: 1. flux kontext, upload your image, and prompt the scene (https://bfl.ai/announcements/flux-1-kontext…) 2. Dump it into veo3 with prompts for animations 3. Eleven labs audio to audio with whosever voice you need kontext will maintain consistency reasonably well but when","Varun Mayya","waitin4agi_·Jul 8",2025-07-08T17:18:57.000Z,https://twitter.com/waitin4agi_·Jul 8/status/1942634521792504098,510,23,18,Yes,AI/ML,0.9999999999999999,30,neutral,es,"AI","","",No,No,1,1,standalone,0.5,low,c94482c2ac769af0,0.8,0.9,0.5,0.8,Technology,"Content analysis required",general,informative,high,AI/ML knowledge and insights,0.775,0.8,Yes,No,Yes,2025-08-25T14:28:21.737Z
1940764345417548113,"built this hero section in 20 mins inside @lovable_dev my go-to stack now for fast, stunning landing pages: lovable + midjourney","Prajwal Tomar","PrajwalTomar_·Admin·Jul 3",2025-07-03T13:27:32.000Z,https://twitter.com/PrajwalTomar_·Admin·Jul 3/status/1940764345417548113,215,14,12,Yes,General,0.9999999999999999,30,neutral,es,"","","@lovable_dev",No,No,1,1,standalone,0.5,low,6c823209d82fa4a9,0.5,0.42,0.5,0.5,General,"Content analysis required",general,informative,medium,General knowledge and information,0.895,0.8,No,No,No,2025-08-25T14:28:23.734Z
1940724698113102012,"Today I'm celebrating 2 years at @weaviate_io! Here are 37 things I learned about retrieval so far. https://leoniemonigatti.com/blog/what_i_learned.html…","Leonie","helloiamleonie·Jul 3",2025-07-03T10:49:59.000Z,https://twitter.com/helloiamleonie·Jul 3/status/1940724698113102012,713,108,17,No,General,0.9999999999999999,30,neutral,es,"Machine Learning","","@weaviate_io",No,No,1,1,standalone,0.5,low,216b11c187574be9,0.8,0.36,0.5,0.8,Technology,"Content analysis required",general,informative,low,AI/ML knowledge and insights,0.91,0.8,Yes,No,Yes,2025-08-25T14:28:24.760Z
1939909421905400185,"Setting up your own MCP server shouldn’t take hours. With Composio, you can launch a fully functional MCP server straight from the dashboard in just a few clicks. No setup scripts. No infra headaches. No complex configs. Just a clean, intuitive interface where you click,","Apoorv | Plxity","apoorv_taneja·Jul 1",2025-07-01T04:50:22.000Z,https://twitter.com/apoorv_taneja·Jul 1/status/1939909421905400185,182,17,16,Yes,AI/ML,0.9999999999999999,30,neutral,es,"AI","","",No,No,1,1,standalone,0.5,low,41c5e6a8cc9912d2,0.8,0.9,0.5,0.8,Technology,"Content analysis required",general,informative,high,AI/ML knowledge and insights,0.775,0.8,No,No,No,2025-08-25T14:28:25.477Z
1959317544772174186,"Working on a project this weekend? Try Codex CLI with GPT-5, included in your ChatGPT plan! ❯ npm i -g @openai/codex ❯ codex Pro tip! Use GPT-5 with high reasoning via this shortcut: ❯ codex -m gpt-5 -c model_reasoning_effort=""high"" Or type /model to pick interactively:","Romain Huet","romainhuet·Aug 23",2025-08-23T18:11:19.000Z,https://twitter.com/romainhuet·Aug 23/status/1959317544772174186,1.1K,130,63,No,AI/ML,0.8999999999999999,30,neutral,es,"AI","","@openai",No,No,1,1,standalone,0.5,low,65869ac8dcc59b18,0.8,0.9,0.5,0.8,Technology,"Content analysis required",technical,question,high,AI/ML knowledge and insights,0.775,0.8,Yes,Yes,No,2025-08-25T14:28:01.102Z
1956776922752627075,"BREAKING: You can now send an AI to argue with customer support for you. It speaks like you on the phone, listens like a lawyer, and never gets tired. Here’s how it works for free ↓","Hasan Toor ✪","hasantoxr·Aug 16",2025-08-16T17:55:48.000Z,https://twitter.com/hasantoxr·Aug 16/status/1956776922752627075,1.3K,117,54,No,AI/ML,0.8999999999999999,30,positive,es,"AI","","",No,No,1,1,standalone,0.5,low,8469452b9f59c518,0.8,0.72,0.7,0.8,Technology,"Content analysis required",general,informative,high,AI/ML knowledge and insights,0.8200000000000001,0.8,No,Yes,No,2025-08-25T14:28:03.877Z
1956647158679310517,"RIP SEO. a16z just called it: traditional search is dead. Welcome to Generative Engine Optimization (GEO). Now people ask AI, not Google and if you’re not in the answer, you don’t exist. Here's how to add this 1 small file to your website to get your brand in any LLM:","Louis Gleeson","aigleeson·Aug 16",2025-08-16T09:20:10.000Z,https://twitter.com/aigleeson·Aug 16/status/1956647158679310517,2.8K,268,96,No,AI/ML,0.8999999999999999,30,neutral,en,"AI","","",No,No,1,1,standalone,0.5,low,e3b899acfc347090,0.8,1,0.5,0.8,Technology,"Content analysis required",general,informative,high,AI/ML knowledge and insights,0.75,0.8,No,No,No,2025-08-25T14:28:03.928Z
1955418785135087641,"Most AI agents are just workflows in disguise.","Aakash Gupta","aakashg0·Aug 13",2025-08-12T23:59:02.000Z,https://twitter.com/aakashg0·Aug 13/status/1955418785135087641,1K,121,63,No,AI/ML,0.8999999999999999,30,neutral,es,"AI","","",No,No,1,1,standalone,0.5,low,f26a621ddc90e2a2,0.8,0.16,0.5,0.8,Technology,"Content analysis required",general,informative,low,AI/ML knowledge and insights,0.96,0.8,No,No,No,2025-08-25T14:28:04.647Z
1953317346174456281,"A new Wan 2.2 LoRA just dropped: Instagirl v2.0. AI-generated, hyper-realistic Instagram girls... What even is real anymore?","Miguel | AP","angrypenguinPNG·Aug 7",2025-08-07T04:48:40.000Z,https://twitter.com/angrypenguinPNG·Aug 7/status/1953317346174456281,3.7K,296,174,No,AI/ML,0.8999999999999999,30,neutral,es,"AI","","",No,No,1,1,standalone,0.5,low,4d5ac53230368c57,0.8,0.36,0.5,0.8,Technology,"Content analysis required",general,question,low,AI/ML knowledge and insights,0.91,0.8,No,Yes,No,2025-08-25T14:28:06.696Z
1953125226415571125,"wow.. this AI is so crazy OpenCreator AI studio now can generate hundreds videos on 1 click for your story.. voice, music and even edit on timeline Veo 3 is now 50% cheaper for a limited time, lowest price anywhere 10 ways to use it like pro:","el.cine","EHuanglu·Aug 6",2025-08-06T16:05:15.000Z,https://twitter.com/EHuanglu·Aug 6/status/1953125226415571125,1.8K,243,46,Yes,AI/ML,0.8999999999999999,30,positive,es,"AI","","",No,No,1,1,standalone,0.5,low,7589d2590cf8ec73,0.8,0.94,0.7,0.8,Technology,"Content analysis required",general,informative,high,AI/ML knowledge and insights,0.765,0.8,No,Yes,No,2025-08-25T14:28:06.851Z
1952767526313857098,"Talking to your AI glasses is silly, so we built Reality Proxy, a direct manipulation interface that lets you instantly select real-world objects and share context with AI. A step toward JARVIS.","xiaoan","_seanliu·Aug 5",2025-08-05T16:23:53.000Z,https://twitter.com/_seanliu·Aug 5/status/1952767526313857098,1K,177,40,Yes,AI/ML,0.8999999999999999,30,neutral,es,"AI","","",No,No,1,1,standalone,0.5,low,b13651d4941bb408,0.8,0.64,0.5,0.8,Technology,"Content analysis required",general,informative,medium,AI/ML knowledge and insights,0.84,0.8,No,No,No,2025-08-25T14:28:07.157Z
1948317599663636542,"Super excited to announce the Google Trends API alpha test. This new API will help Researchers, Journalists, and Developers to understand Search behaviors and patterns. What a challenging & fun journey! https://developers.google.com/search/blog/2025/07/trends-api…","Daniel Waisberg","danielwaisberg·Jul 24",2025-07-24T09:41:28.000Z,https://twitter.com/danielwaisberg·Jul 24/status/1948317599663636542,241,69,17,No,Programming,0.8999999999999999,30,neutral,es,"Science","","",No,No,1,1,standalone,0.5,low,a975689ded79e05e,0.8,0.64,0.5,0.8,Technology,"Content analysis required",technical,informative,medium,Programming knowledge and techniques,0.84,0.8,Yes,No,Yes,2025-08-25T14:28:12.442Z
1948024118961651959,"Roy shared about the clippers but, cluely also has 24+ ugc creators posting every single day here's everything on how cluely is generating millions of views every single week [THREAD]","Murata | The Algo King","MurataAlgoK·Jul 23",2025-07-23T14:15:17.000Z,https://twitter.com/MurataAlgoK·Jul 23/status/1948024118961651959,711,37,14,No,General,0.8999999999999999,30,neutral,en,"","","",No,No,1,1,standalone,0.5,low,6d0836508b75ac7b,0.5,0.6,0.5,0.5,General,"Content analysis required",general,informative,medium,General knowledge and information,0.85,0.8,No,No,No,2025-08-25T14:28:13.212Z
1947682548664176842,"We’re seeing a shift in how top DTC brands are treating their PDPs. They’re no longer just built to convert, they’re built to capture attention. Take Oh Polly’s latest PDP rollout: - Scroll-driven storytelling - Creative motion baked into the UI - Cinematic visuals that mimic","Olly Hudson","oliverwhudson·Jul 22",2025-07-22T15:38:00.000Z,https://twitter.com/oliverwhudson·Jul 22/status/1947682548664176842,226,12,9,Yes,General,0.8999999999999999,30,positive,es,"","","",No,No,1,1,standalone,0.5,low,a77dbcbca8f26647,0.5,0.92,0.7,0.5,General,"Content analysis required",general,informative,high,General knowledge and information,0.77,0.8,No,Yes,No,2025-08-25T14:28:13.314Z
1947390741501907001,"I wrote a blog post on the best models to use for generating consistent characters from a single reference image: https://replicate.com/blog/generate-consistent-characters…","fofr","fofrAI·Jul 22",2025-07-21T20:18:28.000Z,https://twitter.com/fofrAI·Jul 22/status/1947390741501907001,401,38,18,No,General,0.8999999999999999,30,positive,es,"","","",No,No,1,1,standalone,0.5,low,ae78d9f62b433f88,0.5,0.42,0.7,0.5,General,"Content analysis required",general,informative,medium,General knowledge and information,0.895,0.8,Yes,Yes,Yes,2025-08-25T14:28:14.082Z
1947306420648530009,"I just discovered the best guide for starting a remote company in the US. I wish I saw this before starting chatbase. @atlas guides is a gold mine.","Yasser","yasser_elsaid_·Jul 21",2025-07-21T14:43:24.000Z,https://twitter.com/yasser_elsaid_·Jul 21/status/1947306420648530009,685,36,19,No,General,0.8999999999999999,30,positive,es,"","","@atlas",No,No,1,1,standalone,0.5,low,c93aba477b524474,0.8,0.56,0.7,0.5,Business,"Content analysis required",business,informative,medium,Business insights and strategies,0.86,0.8,No,Yes,No,2025-08-25T14:28:14.390Z
1947204374482334029,"1/ After spending countless hours and almost $100 failing to set up US TikTok account using various eSIM providers, I finally found a way - best thing it's 100% FREE. Here's a step-by-step thread, bookmark it and thank me later.","Erikas Mališauskas","malisauskasLT·Jul 21",2025-07-21T07:57:54.000Z,https://twitter.com/malisauskasLT·Jul 21/status/1947204374482334029,614,37,34,No,AI/ML,0.8999999999999999,30,neutral,es,"AI","","",No,No,1,1,standalone,0.5,low,2a11d777a9ad5f7f,0.8,0.8,0.7,0.8,Technology,"Content analysis required",general,informative,high,AI/ML knowledge and insights,0.8,0.8,No,Yes,No,2025-08-25T14:28:14.544Z
1947159527700439342,"After the rain stops, it's like steamy heat. Prompt : { ""description"": ""A chilling, cinematic scene featuring a sleek cooling gift set icebox (with a frosty, insulated design and subtle icy logo) at the center of a sunlit, clean modern space. The icebox pulses with glacial","Jin.B","opener_ai·Jul 21",2025-07-21T04:59:42.000Z,https://twitter.com/opener_ai·Jul 21/status/1947159527700439342,159,22,4,Yes,AI/ML,0.8999999999999999,30,positive,es,"AI","","",No,No,1,1,standalone,0.5,low,8e6d92b7ff9c90e2,0.8,0.92,0.7,0.8,Technology,"Content analysis required",general,informative,high,AI/ML knowledge and insights,0.77,0.8,No,Yes,No,2025-08-25T14:28:14.594Z
1943623341199540276,"Still exporting ads data to spreadsheets? Lexi gives you clean dashboards with ROAS, CPA, CTR — zero clicks needed.","Lexi AI","Lexilexi_AI·Jul 11",2025-07-11T10:48:09.000Z,https://twitter.com/Lexilexi_AI·Jul 11/status/1943623341199540276,320,40,0,Yes,General,0.8999999999999999,30,neutral,es,"Data Analytics","","",No,No,1,1,standalone,0.5,low,35d4bef2ee718696,0.5,0.38,0.5,0.5,General,"Content analysis required",general,question,low,General knowledge and information,0.905,0.8,No,Yes,No,2025-08-25T14:28:15.157Z
1945565895729774776,"SeedEdit 3 is now on Replicate https://replicate.com/bytedance/seededit-3.0… It's an alternative to kontext, based on seedream. > Change the text to ""SEEDEDIT 3 ON REPLICATE"", put her in a garden, she is making the ""ok"" sign with both hands","fofr","fofrAI·Jul 17",2025-07-16T19:27:11.000Z,https://twitter.com/fofrAI·Jul 17/status/1945565895729774776,347,36,11,No,General,0.8999999999999999,30,neutral,es,"","","",No,No,1,1,standalone,0.5,low,1169100824b7a856,0.5,0.76,0.5,0.5,General,"Content analysis required",general,informative,high,General knowledge and information,0.81,0.8,Yes,No,Yes,2025-08-25T14:28:15.977Z
1945169856027927014,"i don't think you understand","Maze","mazeincoding·Jul 15",2025-07-15T17:13:27.000Z,https://twitter.com/mazeincoding·Jul 15/status/1945169856027927014,715,14,40,No,General,0.8999999999999999,30,neutral,es,"","","",No,No,1,1,standalone,0.5,low,c0bb9edcdcc1c04b,0.5,0.1,0.5,0.5,General,"Content analysis required",general,informative,low,General knowledge and information,0.975,0.8,No,No,No,2025-08-25T14:28:16.643Z
1945184544799244311,"Claude for Financial Services Keynote (getting a lot of buzz today)","Brett Caughran","FundamentEdge·Jul 15",2025-07-15T18:11:49.000Z,https://twitter.com/FundamentEdge·Jul 15/status/1945184544799244311,253,22,13,No,General,0.8999999999999999,30,neutral,es,"","","",No,No,1,1,standalone,0.5,low,82a191de847a343e,0.5,0.22,0.5,0.5,General,"Content analysis required",general,informative,low,General knowledge and information,0.945,0.8,No,No,No,2025-08-25T14:28:16.805Z
1945217538389893418,"the Claude Code workflow I used to ship an entire app:","Dan","d4m1n·Jul 16",2025-07-15T20:22:56.000Z,https://twitter.com/d4m1n·Jul 16/status/1945217538389893418,349,23,20,No,Programming,0.8999999999999999,30,neutral,es,"","","",No,No,1,1,standalone,0.5,low,02023fe60f5e021b,0.8,0.22,0.5,0.8,Technology,"Content analysis required",technical,informative,low,Programming knowledge and techniques,0.945,0.8,Yes,No,No,2025-08-25T14:28:16.965Z
1944717444129677662,"TIL annas archive is now a data broker for LLM training","tokenbender","tokenbender·Jul 14",2025-07-14T11:15:44.000Z,https://twitter.com/tokenbender·Jul 14/status/1944717444129677662,451,32,16,No,AI/ML,0.8999999999999999,30,neutral,es,"AI; Data Analytics","","",No,No,1,1,standalone,0.5,low,7a0233423cd9fc96,0.8,0.22,0.5,0.8,Technology,"Content analysis required",general,informative,low,AI/ML knowledge and insights,0.945,0.8,No,No,No,2025-08-25T14:28:17.792Z
1944851548712133032,"24 hours of non-stop stress-testing, Kimi-K2-Instruct cleared every benchmark in our playbook. Now it’s LIVE on the Fireworks Serverless API It is the first open-weights SOTA agentic tool-caller, holding its own on SWE Bench, Tau2 & AceBench. Same prod weights, zero infra","Benny (Yufei) Chen","the_bunny_chen·Jul 15",2025-07-14T20:08:37.000Z,https://twitter.com/the_bunny_chen·Jul 15/status/1944851548712133032,147,25,11,No,General,0.8999999999999999,30,positive,es,"","","",No,No,1,1,standalone,0.5,low,8ed0fdd6c66e54f1,0.5,0.84,0.7,0.5,General,"Content analysis required",general,informative,high,General knowledge and information,0.79,0.8,No,Yes,No,2025-08-25T14:28:17.844Z
1944856794976616680,"My go-to prompt for UX/product design ideation Crazy that this actually improves results","Matt Shumer","mattshumer_·Jul 15",2025-07-14T20:29:28.000Z,https://twitter.com/mattshumer_·Jul 15/status/1944856794976616680,904,48,40,No,General,0.8999999999999999,30,neutral,unknown,"","","",No,No,1,1,standalone,0.5,low,c64ce48415c831d2,0.5,0.26,0.5,0.5,General,"Content analysis required",general,informative,low,General knowledge and information,0.935,0.8,No,No,No,2025-08-25T14:28:18.047Z
1944874787811234036,"We used Kimi K2 to write detailed JSON prompts for Veo 3 and the results are insane. Open source LLMs + Google's best video model = instant cinema. Here's how to do it in under 5 minutes:","GLIF","heyglif·Jul 15",2025-07-14T21:40:58.000Z,https://twitter.com/heyglif·Jul 15/status/1944874787811234036,346,47,8,Yes,AI/ML,0.8999999999999999,30,positive,es,"AI","","",No,No,1,1,standalone,0.5,low,ddeff49bcd7201ed,0.8,0.74,0.7,0.8,Technology,"Content analysis required",general,informative,high,AI/ML knowledge and insights,0.815,0.8,No,Yes,No,2025-08-25T14:28:18.201Z
1944344127522603350,"How I use CodeRabbit + Cursor to ensure that whatever MVP I'm shipping is secure.","Prajwal Tomar","PrajwalTomar_·Admin·Jul 13",2025-07-13T10:32:18.000Z,https://twitter.com/PrajwalTomar_·Admin·Jul 13/status/1944344127522603350,444,43,6,Yes,Programming,0.8999999999999999,30,negative,es,"","","",No,No,1,1,standalone,0.5,low,7718c80b67353049,0.8,0.3,0.7,0.8,Technology,"Content analysis required",technical,informative,low,Programming knowledge and techniques,0.925,0.8,Yes,Yes,No,2025-08-25T14:28:18.712Z
1943731835114336709,"Isometric landmarks with GPT-4o. PROMPT: Create a high-resolution isometric illustration of [LOCATION]. Render the scene as a detailed 3D diorama with bold, saturated colors and soft, glowing lighting. Make all forms slightly exaggerated with rounded edges, glossy surfaces, and","gnrly.xyz","gnrlyxyz·Jul 11",2025-07-11T17:59:16.000Z,https://twitter.com/gnrlyxyz·Jul 11/status/1943731835114336709,430,37,15,No,AI/ML,0.8999999999999999,30,positive,es,"AI","","",No,No,1,1,standalone,0.5,low,4cee6919760dde48,0.8,0.78,0.7,0.8,Technology,"Content analysis required",general,informative,high,AI/ML knowledge and insights,0.8049999999999999,0.8,No,Yes,No,2025-08-25T14:28:19.738Z
1943604985276580210,"This Midjourney V7 style reference has a cartoon aesthetic over blurred realistic backgrounds: --sref 3265932871 But what really makes it special is how expressive the characters are. Jinx’s facial expressions are absolutely hilarious!","OscarAI","Artedeingenio·Jul 11",2025-07-11T09:35:13.000Z,https://twitter.com/Artedeingenio·Jul 11/status/1943604985276580210,440,45,26,No,General,0.8999999999999999,30,neutral,es,"","","",No,No,1,1,standalone,0.5,low,1cd7b463a926f30e,0.5,0.66,0.5,0.5,General,"Content analysis required",general,informative,medium,General knowledge and information,0.835,0.8,No,No,No,2025-08-25T14:28:19.841Z
1943699733102399513,"Shrooms extending lifespans was not on my 2025 bingo card","Markets & Mayhem","Mayhem4Markets·Jul 11",2025-07-11T15:51:43.000Z,https://twitter.com/Mayhem4Markets·Jul 11/status/1943699733102399513,639,84,39,No,General,0.8999999999999999,30,neutral,es,"","","",No,No,1,1,standalone,0.5,low,0f16b26ec7a1ea7b,0.5,0.2,0.5,0.5,General,"Content analysis required",general,informative,low,General knowledge and information,0.95,0.8,No,No,No,2025-08-25T14:28:19.995Z
1943014689820045402,"Claude Max tip: Run `npx ccusage@latest` in your terminal, and it'll output exactly how much value you've gotten from Claude Max each day!","Matt Shumer","mattshumer_·Jul 9",2025-07-09T18:29:36.000Z,https://twitter.com/mattshumer_·Jul 9/status/1943014689820045402,532,45,46,No,General,0.8999999999999999,30,neutral,es,"","","@latest",No,No,1,1,standalone,0.5,low,582ca5bde64b3a70,0.5,0.46,0.5,0.5,General,"Content analysis required",general,informative,medium,General knowledge and information,0.885,0.8,No,No,No,2025-08-25T14:28:20.917Z
1942776934238413049,"Veo3 fast { ""shot"": { ""composition"": ""Medium shot, 85mm lens, shot on RED V-Raptor XL, shallow depth of field, camera static on tripod"", ""camera_motion"": ""no motion, static frame"", ""frame_rate"": ""24fps"", ""film_grain"": ""subtle film grain overlay mimicking Kodak","Emily","IamEmily2050·Jul 9",2025-07-09T02:44:50.000Z,https://twitter.com/IamEmily2050·Jul 9/status/1942776934238413049,154,11,3,Yes,AI/ML,0.8999999999999999,30,neutral,es,"AI","","",No,No,1,1,standalone,0.5,low,75b73f2c230e584c,0.8,0.74,0.5,0.8,Technology,"Content analysis required",general,informative,high,AI/ML knowledge and insights,0.815,0.8,No,No,No,2025-08-25T14:28:21.224Z
1942750556516184276,"From ZERO to ALGO TRADER in 2024 - Step By Step (FULL COURSE) part 2","Moon Dev","MoonDevOnYT·Jul 9",2025-07-09T01:00:01.000Z,https://twitter.com/MoonDevOnYT·Jul 9/status/1942750556516184276,518,97,3,Yes,General,0.8999999999999999,30,neutral,es,"","","",No,No,1,1,standalone,0.5,low,eecd2b11b1b345ea,0.5,0.3,0.5,0.5,General,"Content analysis required",general,informative,low,General knowledge and information,0.925,0.8,No,No,No,2025-08-25T14:28:21.686Z
1941905885917548917,"it's strange that not many people know about this I randomly stumbled across -> http://aikosh.indiaai.gov.in looks like the @OfficialINDIAai is building ""Huggingface"" for datasets, models based on indian usecases seems like a really cool initiative. will try to contribute few","Adithya S K","adithya_s_k·Jul 6",2025-07-06T17:03:36.000Z,https://twitter.com/adithya_s_k·Jul 6/status/1941905885917548917,504,57,20,No,AI/ML,0.8999999999999999,30,positive,en,"AI; Machine Learning; Data Analytics","","@OfficialINDIAai",No,No,1,1,standalone,0.5,low,6350180c3c05e48c,0.8,0.8,0.7,0.8,Technology,"Content analysis required",general,informative,high,AI/ML knowledge and insights,0.8,0.8,Yes,Yes,Yes,2025-08-25T14:28:22.454Z
1941508951197220894,"I’ve used Claude Code for 100+ hours building MVPs. Most developers are missing the best features. Here are 10 tricks that will change how you build ↓","Prajwal Tomar","PrajwalTomar_·Admin·Jul 5",2025-07-05T14:46:20.000Z,https://twitter.com/PrajwalTomar_·Admin·Jul 5/status/1941508951197220894,452,34,11,No,Programming,0.8999999999999999,30,positive,es,"","","",No,No,1,1,standalone,0.5,low,6ec8d90b041eafc2,0.8,0.54,0.7,0.8,Technology,"Content analysis required",technical,informative,medium,Programming knowledge and techniques,0.865,0.8,Yes,Yes,No,2025-08-25T14:28:23.017Z
1941520603372024014,"Can't work without this anymore. claude automatically updates what it's working on, and the little icons next to the git branch show how many files are changed. When I want an update I just press the little magic wand icon to trigger a status update in claude. And terminal","Peter Steinberger","steipete·Jul 5",2025-07-05T15:32:38.000Z,https://twitter.com/steipete·Jul 5/status/1941520603372024014,479,24,15,No,General,0.8999999999999999,30,neutral,es,"","","",No,Yes,2,2,same-session,0.5,low,dd3f5b106e187249,0.5,0.98,0.5,0.5,General,"Content analysis required",general,informative,high,General knowledge and information,0.755,0.8,No,No,No,2025-08-25T14:28:23.120Z
