ID,Text,Author,Author Handle,Timestamp,URL,Like Count,Retweet Count,Reply Count,Has Media,Content Type,Engagement Score,Priority Score,Sentiment,Language,Topics,Hashtags,Mentions,Thread Start,Thread Part,Thread Length,Thread Position,Thread Context,Thread Engagement,Thread Complexity,Content Hash,Relevance Score,Quality Score,Engagement Potential,Learning Value,Knowledge Category,Key Insights,Target Audience,Information Type,Content Value,Bookmark Context,Readability Score,Extraction Confidence,Actionable,Discussion Worthy,Reference Worthy,Processed At
1943905291156041859,"Every once in awhile I get a nice reminder of how insanely good AI tools have gotten. This asset would have taken me 30+ minutes to make before, now I can do it in seconds.","Theo - t3.gg","theo·Jul 12",2025-07-12T05:28:32.000Z,https://twitter.com/theo·Jul 12/status/1943905291156041859,1.4K,27,32,No,AI/ML,0.7,25,positive,es,"AI","","",No,No,1,1,standalone,0.5,low,b949b05ab04a6a18,0.8,0.7,0.7,0.8,Technology,"Content analysis required",general,informative,medium,AI/ML knowledge and insights,0.825,0.8,No,Yes,No,2025-08-25T14:28:19.224Z
1941035551353983241,"7 MCP projects for AI Engineers: (with video tutorials)","Akshay","akshay_pachaar·Jul 4",2025-07-04T07:25:12.000Z,https://twitter.com/akshay_pachaar·Jul 4/status/1941035551353983241,1.1K,178,6,No,AI/ML,0.7,25,neutral,es,"AI","","",No,No,1,1,standalone,0.5,low,b88ee4cd6da3bc08,0.8,0.18,0.5,0.8,Technology,"Content analysis required",general,informative,low,AI/ML knowledge and insights,0.955,0.8,No,No,No,2025-08-25T14:28:24.041Z
1956581602575716654,"Yam Marcovic","Yam Marcovic","ymarcov·Aug 16",2025-08-16T04:59:40.000Z,https://twitter.com/ymarcov·Aug 16/status/1956581602575716654,59,7,0,No,General,0.6,25,neutral,es,"","","",No,No,1,1,standalone,0.5,low,1559b2895532d637,0.5,0.04,0.5,0.5,General,"Content analysis required",general,informative,low,General knowledge and information,0.99,0.8,No,No,No,2025-08-25T14:28:02.392Z
1954431093186130279,"using alpine with multi stage build","Mrinal","Hi_Mrinal·Aug 10",2025-08-10T06:34:18.000Z,https://twitter.com/Hi_Mrinal·Aug 10/status/1954431093186130279,58,0,5,No,General,0.6,25,neutral,es,"","","",No,No,1,1,standalone,0.5,low,ffaa643be4f9f6d5,0.5,0.12,0.5,0.5,General,"Content analysis required",general,informative,low,General knowledge and information,0.97,0.8,No,No,No,2025-08-25T14:28:05.160Z
1953781504661717224,"Notes:","TK • 木下","wordsofteekay·Aug 8",2025-08-08T11:33:04.000Z,https://twitter.com/wordsofteekay·Aug 8/status/1953781504661717224,58,5,0,No,General,0.6,25,neutral,es,"","","",No,No,1,1,standalone,0.5,low,210fe12e1bd591b9,0.5,0.02,0.5,0.5,General,"Content analysis required",general,informative,low,General knowledge and information,0.995,0.8,No,No,No,2025-08-25T14:28:05.468Z
1951903230029599081,"Working on an open-source humanoid robot training platform that allows anyone with a smartphone to create robot skills and earn: https://github.com/manoj92/gephr","Wozart","Wozart·Aug 3",2025-08-03T07:09:29.000Z,https://twitter.com/Wozart·Aug 3/status/1951903230029599081,27,1,2,No,AI/ML,0.6,25,neutral,es,"AI","","",No,No,1,1,standalone,0.5,low,e1995166ecf7d9c4,0.8,0.42,0.5,0.8,Technology,"Content analysis required",general,informative,medium,AI/ML knowledge and insights,0.895,0.8,Yes,No,Yes,2025-08-25T14:28:05.879Z
1953169898487550233,"my agent is EXCITED in the unique Claude way","fabian","fabianstelzer·Aug 7",2025-08-06T19:02:46.000Z,https://twitter.com/fabianstelzer·Aug 7/status/1953169898487550233,19,0,0,No,General,0.6,25,neutral,es,"","","",No,No,1,1,standalone,0.5,low,65c14fecc4e0c721,0.5,0.18,0.5,0.5,General,"Content analysis required",general,informative,low,General knowledge and information,0.955,0.8,No,No,No,2025-08-25T14:28:06.186Z
1951322937891618884,"model card: https://storage.googleapis.com/deepmind-media/Model-Cards/Gemini-2-5-Deep-Think-Model-Card.pdf… was a privilege to work on this with so many talented colleagues @frivolous_loaf @sarah_cogan @onexerxes @_lewisho @rohinmshah @ralucaadapopa @emmons_scott @JoIliazi @ancadianadragan @minhg @joe_stant @shubhar25 @archit_sharma97 and many","Samuel Albanie","SamuelAlbanie·Aug 1",2025-08-01T16:43:36.000Z,https://twitter.com/SamuelAlbanie·Aug 1/status/1951322937891618884,61,3,2,No,General,0.6,25,neutral,es,"","","@frivolous_loaf; @sarah_cogan; @onexerxes; @_lewisho; @rohinmshah; @ralucaadapopa; @emmons_scott; @JoIliazi; @ancadianadragan; @minhg; @joe_stant; @shubhar25; @archit_sharma97",No,No,1,1,standalone,0.5,low,5184c68faf5e5e5a,0.5,0.6,0.5,0.5,General,"Content analysis required",general,informative,medium,General knowledge and information,0.85,0.8,Yes,No,Yes,2025-08-25T14:28:07.979Z
1951326505117618664,"3 days left to apply. Come build with us.","Ruchi Sanghvi","rsanghvi·Aug 1",2025-08-01T16:57:47.000Z,https://twitter.com/rsanghvi·Aug 1/status/1951326505117618664,15,2,3,No,General,0.6,25,neutral,es,"","","",No,No,1,1,standalone,0.5,low,4ba66360c46ff2c6,0.5,0.18,0.5,0.5,General,"Content analysis required",general,informative,low,General knowledge and information,0.955,0.8,No,No,No,2025-08-25T14:28:08.236Z
1951044998897729623,"Gemini CLI just launched a new slash commands feature that supercharged my workflow! I created a pack of 10+ practical slash commands for the Gemini CLI to automate your entire daily workflow. Get started! https://github.com/amitkmaraj/gemini-cli-custom-slash-commands?utm_campaign=CDR_0x5f9e213a_default_b435511645&utm_source=external&utm_medium=web… #GeminiCLI #GoogleCloud #Gemini","Agentic Amit","agenticamit·Aug 1",2025-07-31T22:19:11.000Z,https://twitter.com/agenticamit·Aug 1/status/1951044998897729623,33,5,3,No,AI/ML,0.6,25,neutral,es,"AI; Cloud Computing","#GeminiCLI; #GoogleCloud; #Gemini","",No,No,1,1,standalone,0.5,low,8097d06acfcf2483,0.8,0.76,0.5,0.8,Technology,"Content analysis required",general,question,high,AI/ML knowledge and insights,0.81,0.8,Yes,Yes,Yes,2025-08-25T14:28:08.646Z
1950482894431895793,"Building a new side project with a very new tech stack, most of these for the first time. Elysia instead of Express/NestJS for web framework. It is noticeably faster even when doing localhost development, even before any traffic at scale. Drizzle ORM (instead of TypeORM that","Arnav Gupta","championswimmer·Jul 30",2025-07-30T09:05:34.000Z,https://twitter.com/championswimmer·Jul 30/status/1950482894431895793,73,2,4,No,Technology,0.6,25,neutral,es,"Technology","","",No,No,1,1,standalone,0.5,low,1a3e6cd79441a4b8,0.5,0.92,0.5,0.5,General,"Content analysis required",general,informative,high,General knowledge and information,0.77,0.8,No,No,No,2025-08-25T14:28:09.262Z
1949805660318711911,"Huge update from n8n About 25+ verified new nodes released. This makes things much more easier for non techies. Search them and they are right there in n8n node list. Here are some worth the mention:","Archit Jain","architjn·Jul 28",2025-07-28T12:14:29.000Z,https://twitter.com/architjn·Jul 28/status/1949805660318711911,26,3,4,No,Technology,0.6,25,neutral,en,"Technology","","",No,No,1,1,standalone,0.5,low,405efda47d204d9d,0.5,0.72,0.5,0.5,General,"Content analysis required",general,informative,high,General knowledge and information,0.8200000000000001,0.8,No,No,No,2025-08-25T14:28:10.647Z
1946062981982208003,"Want robot imitation learning to generalize to new tasks? Blindfold your human demonstrator! Best robotics paper at EXAIT Workshop #ICML2025 https://openreview.net/forum?id=zqfT2QOiiF… Wait, why does this make sense? Read below!","Aviv Tamar","AvivTamar1·Jul 18",2025-07-18T04:22:25.000Z,https://twitter.com/AvivTamar1·Jul 18/status/1946062981982208003,0,0,8,No,AI/ML,0.5,25,positive,es,"AI; Machine Learning","#ICML2025","",No,No,1,1,standalone,0.5,low,83d597c04460ce81,0.8,0.58,0.7,0.8,Technology,"Content analysis required",general,question,medium,AI/ML knowledge and insights,0.855,0.8,Yes,Yes,Yes,2025-08-25T14:28:15.669Z
1947563226490933584,"melatonin before sleep = DMT demons magnesium before sleep = knock tf out but dehydration l-theanine before sleep = background bliss. floating on clouds. zen garden. forehead kisses. roly poly down the hill.","shapegrifter","shapegrifter·Jul 22",2025-07-22T07:43:51.000Z,https://twitter.com/shapegrifter·Jul 22/status/1947563226490933584,13K,569,199,No,General,1,20,neutral,es,"Cloud Computing","","",No,No,1,1,standalone,0.5,low,772bc5291f5cdf17,0.5,0.66,0.5,0.5,General,"Content analysis required",general,informative,medium,General knowledge and information,0.835,0.8,No,No,No,2025-08-25T14:28:13.109Z
1957912985709531408,"So Alibaba Qwen has released the best image editing model... 100% open source! You can edit any photo using natural language. It can be used both locally and online. More below","Paul Couvert","itsPaulAi·Aug 20",2025-08-19T21:10:06.000Z,https://twitter.com/itsPaulAi·Aug 20/status/1957912985709531408,2.3K,299,65,Yes,General,0.9999999999999999,20,positive,es,"","","",No,No,1,1,standalone,0.5,low,111eca269dbf8334,0.5,0.62,0.7,0.5,General,"Content analysis required",general,informative,medium,General knowledge and information,0.845,0.8,No,Yes,No,2025-08-25T14:28:01.775Z
1957500569029079083,"Excited to introduce Qwen-Image-Edit! Built on 20B Qwen-Image, it brings precise bilingual text editing (Chinese & English) while preserving style, and supports both semantic and appearance-level editing. Key Features Accurate text editing with bilingual support","Qwen","Alibaba_Qwen·Aug 18",2025-08-18T17:51:18.000Z,https://twitter.com/Alibaba_Qwen·Aug 18/status/1957500569029079083,3.6K,819,149,Yes,General,0.9999999999999999,20,neutral,es,"","","",No,No,1,1,standalone,0.5,low,3fb9f6204a8f3df5,0.5,0.7,0.5,0.5,General,"Content analysis required",general,informative,medium,General knowledge and information,0.825,0.8,No,No,No,2025-08-25T14:28:02.854Z
1957473246393102489,"over the weekend @chesterzelaya build cool drone detection demo; I decided to make ""small improvements"" it's the same model all I did was add supervision and trackers on top of it, two libraries I built supervision: https://github.com/roboflow/supervision…","SkalskiP","skalskip92·Aug 18",2025-08-18T16:02:44.000Z,https://twitter.com/skalskip92·Aug 18/status/1957473246393102489,2.4K,264,58,Yes,General,0.9999999999999999,20,positive,es,"","","@chesterzelaya",No,No,1,1,standalone,0.5,low,e0f69d065f953649,0.5,0.74,0.7,0.5,General,"Content analysis required",general,informative,high,General knowledge and information,0.815,0.8,Yes,Yes,Yes,2025-08-25T14:28:03.262Z
1941627056711704687,"Mainiu's automatic car awnings are becoming popular in China to avoid cars becoming boiling hot when parked outside during the summer.","Dott. Orikron","orikron·Jul 6",2025-07-05T22:35:38.000Z,https://twitter.com/orikron·Jul 6/status/1941627056711704687,14K,2.2K,353,Yes,AI/ML,0.9,20,neutral,es,"AI","","",No,No,1,1,standalone,0.5,low,9b833f9a38360a81,0.8,0.42,0.5,0.8,Technology,"Content analysis required",general,informative,medium,AI/ML knowledge and insights,0.895,0.8,No,No,No,2025-08-25T14:28:23.068Z
1959610913134133549,"I saw a photo of a new U.S. reshoring factory. The #1 robot brand powering Trump’s “Make America Great Again” revival isn’t... American. It’s Japanese. That sent me down a rabbit hole.... What I found is a 40-year silent invasion that reshaped American factories while almost","Ilir Aliu - eu/acc","IlirAliu_·Aug 24",2025-08-24T13:37:04.000Z,https://twitter.com/IlirAliu_·Aug 24/status/1959610913134133549,1K,151,63,No,AI/ML,0.8999999999999999,20,positive,es,"AI","#1","",No,No,1,1,standalone,0.5,low,a60f85cce601f559,0.8,0.92,0.7,0.8,Technology,"Content analysis required",general,informative,high,AI/ML knowledge and insights,0.77,0.8,No,Yes,No,2025-08-25T14:28:00.896Z
1957526292045393976,"HOW TO SECURE YOUR RAW DOG VPS SERVER - Disable password auth, use only key-based auth (both Hetzner and Digital Ocean do this by default usually) - Install fail2ban on SSH - Enable unattended-upgrades with auto reboot - Enable firewall in Hetzner/Digital Ocean dashboard and","","levelsio",2025-08-18T19:33:31.000Z,https://twitter.com/levelsio/status/1957526292045393976,2.3K,125,113,No,AI/ML,0.8999999999999999,20,negative,es,"AI","","",No,No,1,1,standalone,0.5,low,ec8076f2895fedf0,0.8,0.9,0.7,0.8,Technology,"Content analysis required",general,informative,high,AI/ML knowledge and insights,0.775,0.8,No,Yes,No,2025-08-25T14:28:02.135Z
1947138359765447166,"As wrong as shoplifting is, it’s not a crime limited to Indians or immigrants. Grok says; “According to FBI 2019 data, 69.4% of those arrested for shoplifting were White, 26.6% Black, and 4% other races however the arrest rate for blacks is higher. Reports also indicate","Shilpa Godbole","godbole_shilpa·Jul 21",2025-07-21T03:35:35.000Z,https://twitter.com/godbole_shilpa·Jul 21/status/1947138359765447166,62,13,13,Yes,General,0.8999999999999999,20,neutral,es,"Data Analytics","","",No,No,1,1,standalone,0.5,low,18703cbb1fe613ca,0.5,0.92,0.5,0.5,General,"Content analysis required",general,informative,high,General knowledge and information,0.77,0.8,No,No,No,2025-08-25T14:28:14.748Z
1946660320275304827,"announcing: kisuke, a native ios ide kisuke is your fav pocket engineer. you get: - claude code (use your anthropic acc + all CC features) - multi tab terminal - code editor - browser + built-in devtools - port forwarding (auto-detected and available inapp)","kyon","0xKyon·Jul 20",2025-07-19T19:56:02.000Z,https://twitter.com/0xKyon·Jul 20/status/1946660320275304827,10K,720,520,No,AI/ML,0.8999999999999999,20,neutral,es,"AI","","",No,No,1,1,standalone,0.5,low,f4880521e4dcdf2a,0.8,0.88,0.5,0.8,Technology,"Content analysis required",technical,informative,high,AI/ML knowledge and insights,0.78,0.8,Yes,No,No,2025-08-25T14:28:15.413Z
1944780685409165589,"You can now run Kimi K2 locally with our Dynamic 1.8-bit GGUFs! We shrank the full 1.1TB model to just 245GB (-80% size reduction). The 2-bit XL GGUF performs exceptionally well on coding & passes all our code tests Guide: https://docs.unsloth.ai/basics/kimi-k2 GGUFs: https://huggingface.co/unsloth/Kimi-K2-Instruct-GGUF…","Unsloth AI","UnslothAI·Jul 14",2025-07-14T15:27:02.000Z,https://twitter.com/UnslothAI·Jul 14/status/1944780685409165589,1.7K,324,53,No,AI/ML,0.8999999999999999,20,neutral,es,"AI; Programming","","",No,No,1,1,standalone,0.5,low,03410f659cfd1c5c,0.8,0.86,0.5,0.8,Technology,"Content analysis required",technical,informative,high,AI/ML knowledge and insights,0.785,0.8,Yes,No,Yes,2025-08-25T14:28:17.691Z
1944705474059718789,"Claude Code pro tip: Use Kimi K2 as your agent by changing the base URL and setting the API key before running claude. all prompts and code requests will now go through Kimi, in the CC terminal you're used to!","Ian Nuttall","iannuttall·Jul 14",2025-07-14T10:28:10.000Z,https://twitter.com/iannuttall·Jul 14/status/1944705474059718789,1.5K,145,93,No,Programming,0.8999999999999999,20,neutral,es,"","","",No,No,1,1,standalone,0.5,low,2e223a3231572adb,0.8,0.8,0.5,0.8,Technology,"Programming tips",technical,informative,high,Programming knowledge and techniques,0.8,0.8,Yes,No,No,2025-08-25T14:28:18.406Z
1941942437725028703,"You can turn on the ""Agent mode"" of Gemini Code Assist to make it 10x better This enables Gemini to use tools and even MCPs: 1. Press Ctrl/Cmd+Shift+P 2. Type ""Open User Settings (JSON)"" and select it 3. Add this line to the file: ""geminicodeassist.updateChannel"": ""Insiders""","Paul Couvert","itsPaulAi·Jul 7",2025-07-06T19:28:51.000Z,https://twitter.com/itsPaulAi·Jul 7/status/1941942437725028703,1K,151,24,Yes,Programming,0.8999999999999999,20,neutral,es,"Technology","","",No,No,1,1,standalone,0.5,low,1c7833e050d28f21,0.8,0.92,0.5,0.8,Technology,"Content analysis required",technical,informative,high,Programming knowledge and techniques,0.77,0.8,Yes,No,No,2025-08-25T14:28:22.556Z
1941546894532149519,"Introducing NotebookLlama - an open-source version of NotebookLM! NotebookLlama is a full implementation of NotebookLM that includes all the capabilities that makes it so great for researchers+business users: Create a knowledge repository of documents. Has likely higher","Jerry Liu","jerryjliu0·Jul 5",2025-07-05T17:17:06.000Z,https://twitter.com/jerryjliu0·Jul 5/status/1941546894532149519,1.2K,232,17,Yes,Business,0.8999999999999999,20,positive,es,"Business; Science","","",No,No,1,1,standalone,0.5,low,2e2a86755e899f5a,0.8,0.74,0.7,0.5,Business,"Content analysis required",business,informative,high,Business insights and strategies,0.815,0.8,No,Yes,No,2025-08-25T14:28:22.710Z
1944992896907706790,"Entire Hanuman Chalisa in a single Frame.","Bhagavad Gita","GitaShlokas_·Jul 15",2025-07-15T05:30:17.000Z,https://twitter.com/GitaShlokas_·Jul 15/status/1944992896907706790,15K,1.4K,97,No,General,0.8,20,neutral,es,"","","",No,No,1,1,standalone,0.5,low,be773f6365175a94,0.5,0.14,0.5,0.5,General,"Content analysis required",general,informative,low,General knowledge and information,0.965,0.8,No,No,No,2025-08-25T14:28:17.537Z
1959617987721486543,"These are extremely good textbooks. Pedagogically unique--very different from most mathematics texts. If you come from a humanist background or otherwise worry that you don't ""get"" math, I strongly recommend these.","T. Greer","Scholars_Stage·23h",2025-08-24T14:05:10.000Z,https://twitter.com/Scholars_Stage·23h/status/1959617987721486543,5.5K,351,43,No,General,0.7999999999999999,20,positive,es,"","","",No,No,1,1,standalone,0.5,low,e0f2af40c02f2c40,0.5,0.62,0.7,0.5,General,"Content analysis required",general,informative,medium,General knowledge and information,0.845,0.8,No,Yes,No,2025-08-25T14:28:00.691Z
1958886587984392505,"Neurodevelopmental timing of stress influences the onset of mental disorders. When trauma happens is just as important as what happens.","Nicholas Fabiano, MD","NTFabiano·Aug 22",2025-08-22T13:38:51.000Z,https://twitter.com/NTFabiano·Aug 22/status/1958886587984392505,1K,171,22,No,General,0.7999999999999999,20,neutral,es,"","","",No,No,1,1,standalone,0.5,low,a7ac515ed3d1cd55,0.5,0.4,0.5,0.5,General,"Content analysis required",general,informative,low,General knowledge and information,0.9,0.8,No,No,No,2025-08-25T14:28:01.358Z
1958592749378445319,"Introducing Mirage 2 — a real-time, general-domain generative world engine you can play online Upload any image—photos, concept art, classic paintings, kids' drawings—and step into it as a live, interactive world. Prompt your worlds with text to create any surreal scenes and","Dynamics Lab","DynamicsLab_AI·Aug 21",2025-08-21T18:11:15.000Z,https://twitter.com/DynamicsLab_AI·Aug 21/status/1958592749378445319,6.7K,1K,299,Yes,AI/ML,0.7999999999999999,20,positive,es,"AI","","",No,No,1,1,standalone,0.5,low,8fa73aa10bc2199c,0.8,0.84,0.7,0.8,Technology,"Content analysis required",general,informative,high,AI/ML knowledge and insights,0.79,0.8,No,Yes,No,2025-08-25T14:28:01.571Z
1958137957023686862,"Researchers just developed a machine learning-optimised diet that reduces dementia risk by 36% - stronger than any existing dietary pattern. The MODERN diet analysed 185,012 people over 10 years - here's what they found","Dr. Dominic Ng","DrDominicNg·Aug 20",2025-08-20T12:04:04.000Z,https://twitter.com/DrDominicNg·Aug 20/status/1958137957023686862,1.3K,206,36,No,AI/ML,0.7999999999999999,20,neutral,es,"Machine Learning; Science","","",No,No,1,1,standalone,0.5,low,98df4c96ef3b0f0e,0.8,0.68,0.5,0.8,Technology,"Content analysis required",general,informative,medium,AI/ML knowledge and insights,0.83,0.8,No,No,No,2025-08-25T14:28:01.826Z
1957735207307554820,"This is how you ship ecom small packets from India via @IndiaPostOffice for people who had no clue, no yt videos. 388rs shipping cost Mumbai to Singapore LFG India!!!","Vishal Tejwani","ivishaltejwani·Aug 19",2025-08-19T09:23:41.000Z,https://twitter.com/ivishaltejwani·Aug 19/status/1957735207307554820,1.7K,155,36,No,AI/ML,0.7999999999999999,20,neutral,en,"AI","","@IndiaPostOffice",No,No,1,1,standalone,0.5,low,78f4a01bb4949ac0,0.8,0.58,0.5,0.8,Technology,"Content analysis required",general,informative,medium,AI/ML knowledge and insights,0.855,0.8,No,No,No,2025-08-25T14:28:02.546Z
1957606481131659347,"The Private Irrevocable Trust: India’s Most Powerful Wealth Shield If HUF saves you taxes, an Irrevocable Trust saves your assets and taxes. Family fights, divorce, court cases wealth can vanish overnight. That’s why India’s richest families (Ambanis, Birlas, Tatas) use Trusts.","Prem Soni","ValueWithPrem·Aug 19",2025-08-19T00:52:10.000Z,https://twitter.com/ValueWithPrem·Aug 19/status/1957606481131659347,3K,507,46,No,General,0.7999999999999999,20,neutral,es,"","","",No,No,1,1,standalone,0.5,low,8c59e37dcb88eee6,0.5,0.82,0.5,0.5,General,"Content analysis required",general,informative,high,General knowledge and information,0.795,0.8,No,No,No,2025-08-25T14:28:02.648Z
1948435017559949764,"introducing: Snacker News speak to navigate the feed; eat doritos to scroll an article the more you eat, the more you learn a hands-free calorie-rich experience thread below with a live demo and tutorial on how I built this","AA","measure_plan·Jul 24",2025-07-24T17:28:03.000Z,https://twitter.com/measure_plan·Jul 24/status/1948435017559949764,92,7,13,Yes,General,0.7999999999999999,20,neutral,es,"","","",No,No,1,1,standalone,0.5,low,87532d33820a9ddd,0.5,0.78,0.5,0.5,General,"Content analysis required",general,informative,high,General knowledge and information,0.8049999999999999,0.8,No,No,No,2025-08-25T14:28:11.005Z
1947280900326121631,"Office ka kiraya de rahe ho, par use nahi kar rahe? Smart bano – try karo Virtual Office by http://Aaddress.in","Aaddress","aaddress_in·Jul 21",2025-07-21T13:02:00.000Z,https://twitter.com/aaddress_in·Jul 21/status/1947280900326121631,86,16,3,Yes,General,0.7999999999999999,20,neutral,es,"","","",No,No,1,1,standalone,0.5,low,e13ca2dde310e911,0.5,0.4,0.5,0.5,General,"Content analysis required",general,question,low,General knowledge and information,0.9,0.8,Yes,Yes,Yes,2025-08-25T14:28:13.929Z
1943729761571811338,"Claude Code tip from Anthropic: Spend more time on the task but do it smarter 1. Put this file in ~/.claude/commands/ In claude code 2. type ""/explore-plan-code-test <Whatever task you want>"" 3. Enjoy","ℏεsam","Hesamation·Jul 11",2025-07-11T17:51:02.000Z,https://twitter.com/Hesamation·Jul 11/status/1943729761571811338,2.3K,185,23,No,Programming,0.7999999999999999,20,negative,es,"","","",No,No,1,1,standalone,0.5,low,880c3d3ef08a7780,0.8,0.66,0.7,0.8,Technology,"Programming tips",technical,informative,medium,Programming knowledge and techniques,0.835,0.8,Yes,Yes,No,2025-08-25T14:28:20.200Z
1959480811293708369,"so far, i've got around 13 offers (the ones i joined + the ones i didn't). 11 of them came from my connections and online presence. sharing everything i learnt about building a vibrant online presence that kept me employed. 1/n","Ajeet ( opensox.ai )","ajeetunc·Aug 24",2025-08-24T05:00:05.000Z,https://twitter.com/ajeetunc·Aug 24/status/1959480811293708369,1K,69,45,No,General,0.7,20,neutral,unknown,"","","",No,No,1,1,standalone,0.5,low,4c8fe876519133f5,0.5,0.82,0.5,0.5,General,"Content analysis required",general,informative,high,General knowledge and information,0.795,0.8,No,No,No,2025-08-25T14:28:01.051Z
1957523983840256417,"We are bringing this form of education back and it costs $20k Kids are set up with caltech phd's as math tutors, harvard philosophy majors as writing tutors...etc Then, they also get interest-based apprenticeships. One kid is working with a staff writer from the Tonight Show.","Ben Somers","ben_m_somers·Aug 19",2025-08-18T19:24:21.000Z,https://twitter.com/ben_m_somers·Aug 19/status/1957523983840256417,1.2K,66,37,No,Technology,0.7,20,neutral,en,"Technology","","",No,No,1,1,standalone,0.5,low,805c9644ad389f0d,0.5,0.92,0.5,0.5,General,"Content analysis required",general,informative,high,General knowledge and information,0.77,0.8,No,No,No,2025-08-25T14:28:02.596Z
1957490053187256725,"Very moving, and also true.","Demis Hassabis","demishassabis·Aug 18",2025-08-18T17:09:31.000Z,https://twitter.com/demishassabis·Aug 18/status/1957490053187256725,1.1K,95,49,No,General,0.7,20,neutral,es,"","","",No,No,1,1,standalone,0.5,low,0ec8eba6ec5be7ef,0.5,0.1,0.5,0.5,General,"Content analysis required",general,informative,low,General knowledge and information,0.975,0.8,No,No,No,2025-08-25T14:28:03.365Z
1948334312501473383,"The proper way to revert changes & version control You can do esc + esc to revery history + ccundo OR yoyo for proper version control","Jason Zhou","jasonzhou1993·Jul 24",2025-07-24T10:47:53.000Z,https://twitter.com/jasonzhou1993·Jul 24/status/1948334312501473383,63,2,4,Yes,General,0.7,20,neutral,es,"","","",No,No,1,1,standalone,0.5,low,1f0b02fccc528c8d,0.5,0.52,0.5,0.5,General,"Content analysis required",general,informative,medium,General knowledge and information,0.87,0.8,No,No,No,2025-08-25T14:28:12.340Z
1948153332452978798,"Veo-3 fast on Flow generate a hyper-realistic, 8-second animated cinemagraph of a portrait, focusing on subtle, lifelike micro-movements."" }, ""animation_parameters"": { ""type"": ""Cinemagraph / Ultra-slow motion video"", ""duration_seconds"": 8, ""looping"": ""true, seamless loop"",","Iqra Saifi","IqraSaifiii·Jul 24",2025-07-23T22:48:44.000Z,https://twitter.com/IqraSaifiii·Jul 24/status/1948153332452978798,85,6,7,Yes,AI/ML,0.7,20,positive,es,"AI; Machine Learning","","",No,No,1,1,standalone,0.5,low,c133fc8fccd9af4b,0.8,0.66,0.7,0.8,Technology,"Content analysis required",general,informative,medium,AI/ML knowledge and insights,0.835,0.8,No,Yes,No,2025-08-25T14:28:12.596Z
