ID,Text,Author,Author Handle,Timestamp,URL,Like Count,Retweet Count,Reply Count,Has Media,Content Type,Engagement Score,Priority Score,Sentiment,Language,Topics,Hashtags,Mentions,Thread Start,Thread Part,Thread Length,Thread Position,Thread Context,Thread Engagement,Thread Complexity,Content Hash,Relevance Score,Quality Score,Engagement Potential,Learning Value,Knowledge Category,Key Insights,Target Audience,Information Type,Content Value,Bookmark Context,Readability Score,Extraction Confidence,Actionable,Discussion Worthy,Reference Worthy,Processed At
1940948657110736973,"Cursor pro tip add a Structure Planner custom mode paste your feature → get observations, approach, reasoning, and colored mermaid diagrams scope everything before writing a single line of code build from clarity, not guesswork","Vivek Chavan","devloperVivek·Jul 4",2025-07-04T01:39:55.000Z,https://twitter.com/devloperVivek·Jul 4/status/1940948657110736973,214,14,2,Yes,AI/ML,0.8999999999999999,40,neutral,es,"AI","","",No,No,1,1,standalone,0.5,low,0858502f9c19a88e,0.8,0.7,0.5,0.8,Technology,"Content analysis required",technical,informative,medium,AI/ML knowledge and insights,0.825,0.8,Yes,No,No,2025-08-25T14:28:23.580Z
1959373802745553292,"Since RL environments are becoming a lot more mainstream it probably makes sense to explain them for people who see it vague posted incessantly on the TL. An RL environment is the ""world"" or ""problem space"" in which a reinforcement learning (RL) agent operates in order to learn.","Jay","jayendra_ram·Aug 24",2025-08-23T21:54:52.000Z,https://twitter.com/jayendra_ram·Aug 24/status/1959373802745553292,171,11,3,No,AI/ML,0.7999999999999999,40,negative,es,"AI","","",No,No,1,1,standalone,0.5,low,1015aadd83408944,0.8,0.96,0.7,0.8,Technology,"Content analysis required",general,informative,high,AI/ML knowledge and insights,0.76,0.8,No,Yes,No,2025-08-25T14:28:00.999Z
1958982526875181475,"The secret? LLMs already know when they're uncertain - we just weren't listening! Previous methods use confidence/entropy AFTER full generation for test-time and RL. We're different - we capture reasoning errors DURING generation. DeepConf monitors ""local confidence"" in","Jiawei Zhao","jiawzhao·Aug 23",2025-08-22T20:00:05.000Z,https://twitter.com/jiawzhao·Aug 23/status/1958982526875181475,273,23,4,No,AI/ML,0.7999999999999999,40,neutral,es,"AI","","",No,No,1,1,standalone,0.5,low,d759f9504dfc4899,0.8,0.76,0.5,0.8,Technology,"Content analysis required",general,question,high,AI/ML knowledge and insights,0.81,0.8,No,Yes,No,2025-08-25T14:28:01.205Z
1957599336206045511,"Huge day for us! We're officially SOC2 Type2 compliant","Danny Postma","dannypostmaa·Aug 19",2025-08-19T00:23:46.000Z,https://twitter.com/dannypostmaa·Aug 19/status/1957599336206045511,295,4,38,No,General,0.7999999999999999,40,neutral,es,"","","",No,No,1,1,standalone,0.5,low,594853713d4cf0b5,0.5,0.18,0.5,0.5,General,"Content analysis required",general,informative,low,General knowledge and information,0.955,0.8,No,No,No,2025-08-25T14:28:02.495Z
1957471180601872673,"If my follower count went to zero, here's how I'd start building up audience on X again. 1) Get crystal clear on who you're creating for • my ICP = early stage founders 2) Find 25 people who are beloved by your ICP • scroll your feed until you find a high engagement post","Alex Lieberman","businessbarista·Aug 18",2025-08-18T15:54:32.000Z,https://twitter.com/businessbarista·Aug 18/status/1957471180601872673,267,5,30,No,AI/ML,0.7999999999999999,40,positive,es,"AI","","",No,No,1,1,standalone,0.5,low,1bc42960b9ef8352,0.8,1,0.7,0.8,Technology,"Content analysis required",general,informative,high,AI/ML knowledge and insights,0.73,0.8,No,Yes,Yes,2025-08-25T14:28:02.957Z
1947505247225843846,"MegaTTS 3 voice cloning is here For context: a while back, ByteDance released MegaTTS 3 (with exceptional voice cloning capabilities), but for various reasons, they decided not to release the WavVAE encoder necessary for voice cloning to work. Recently, a WavVAE encoder","mrfakename","realmrfakename·Jul 22",2025-07-22T03:53:28.000Z,https://twitter.com/realmrfakename·Jul 22/status/1947505247225843846,237,43,9,No,Programming,0.7999999999999999,40,neutral,es,"","","",No,No,1,1,standalone,0.5,low,045e368a6d2cb03e,0.8,0.84,0.5,0.8,Technology,"Content analysis required",technical,informative,high,Programming knowledge and techniques,0.79,0.8,Yes,No,No,2025-08-25T14:28:13.724Z
1945372368341499984,"This has proven to be some of the best business advice I've ever read. Whenever you move to a new place or invest in a new area, you need to find a person who knows that area that you can trust, to guide you. Don't just read your domestic market's business thinkers. Read","molson","Molson_Hart·Jul 16",2025-07-16T06:38:10.000Z,https://twitter.com/Molson_Hart·Jul 16/status/1945372368341499984,149,10,18,No,Business,0.7999999999999999,40,positive,en,"Business","","",No,No,1,1,standalone,0.5,low,bc645da3c6aab3b4,0.8,1,0.7,0.5,Business,"Market analysis",business,informative,high,Business insights and strategies,0.735,0.8,No,Yes,Yes,2025-08-25T14:28:16.592Z
1941770479980654606,"This guy pulled off a 6-day vacation to Sri Lanka for just 19,000 INR from India You don't need luxurious stays or business class tickets to explore the world in your 20s You just need to allocate money in a smart way","Sumit Behal","sumitkbehal·Jul 6",2025-07-06T08:05:33.000Z,https://twitter.com/sumitkbehal·Jul 6/status/1941770479980654606,473,29,8,No,Business,0.7999999999999999,40,neutral,es,"Business","","",No,No,1,1,standalone,0.5,low,2979e3d5fe8f911d,0.8,0.84,0.5,0.5,Business,"Content analysis required",business,informative,high,Business insights and strategies,0.79,0.8,No,No,No,2025-08-25T14:28:23.478Z
1957644595195416634,"Marwaris of Calcutta during before and during British Rule (The timeline of this article stops at 15th August 1947) The settlement of Marwari businessmen in Calcutta is a layered story of migration, community networks, and strategic economic positioning—woven into the very","Kaushik | কৌশিক","kachatterjee·Aug 19",2025-08-19T03:23:37.000Z,https://twitter.com/kachatterjee·Aug 19/status/1957644595195416634,99,42,9,No,Business,0.7,40,positive,es,"Business","","",No,No,1,1,standalone,0.5,low,fb4f703a267797a5,0.8,0.82,0.7,0.5,Business,"Content analysis required",business,informative,high,Business insights and strategies,0.795,0.8,No,Yes,No,2025-08-25T14:28:02.238Z
1957790545675194616,"Link to the paper - https://arxiv.org/abs/2508.12485 Aayush's Profile - https://linkedin.com/in/zyushg/ More about me - https://arpitbhayani.me","Arpit Bhayani","arpit_bhayani·Aug 19",2025-08-19T13:03:34.000Z,https://twitter.com/arpit_bhayani·Aug 19/status/1957790545675194616,101,0,3,No,General,0.7,40,neutral,es,"","","",No,No,1,1,standalone,0.5,low,b9b13c062611f018,0.5,0.3,0.5,0.5,General,"Content analysis required",general,informative,low,General knowledge and information,0.925,0.8,Yes,No,Yes,2025-08-25T14:28:02.340Z
1955508035201405296,"If you want to make money with AI video right now, you need to stop making artsy short films and start making content that brands can see themselves in. I created viral short films for 6 months to little success until I created this fake pharma ad.","PJ Ace","PJaccetturo·Aug 13",2025-08-13T05:53:41.000Z,https://twitter.com/PJaccetturo·Aug 13/status/1955508035201405296,45,2,1,Yes,AI/ML,0.7,40,positive,es,"AI","","",No,No,1,1,standalone,0.5,low,7d1d14f32c64a728,0.8,0.94,0.7,0.8,Technology,"Content analysis required",general,informative,high,AI/ML knowledge and insights,0.765,0.8,No,Yes,No,2025-08-25T14:28:04.289Z
1955275691462889816,"Julius (@juliusai_) Julius is an AI data analyst where you can upload files and create analyzes/visualizations in natural language. IMO, it's much more reliable than ChatGPT - and easier to use for repeat flows. Ex. Plot data exports from the Fed + ask Qs on trends","Olivia Moore","omooretweets·Aug 12",2025-08-12T14:30:26.000Z,https://twitter.com/omooretweets·Aug 12/status/1955275691462889816,36,1,5,Yes,AI/ML,0.7,40,neutral,es,"AI; Data Analytics","","@juliusai_",No,No,1,1,standalone,0.5,low,1ddc69614ba8d9fe,0.8,0.92,0.5,0.8,Technology,"AI trend identification",general,informative,high,AI/ML knowledge and insights,0.77,0.8,No,No,No,2025-08-25T14:28:04.750Z
1946971519432982748,"Hibakod is using the full-width “＠” (Unicode U+FF20) instead of the standard “” to reference usernames without triggering actual mentions on X. This avoids sending notifications to those users while still visually tagging them in the list. It's a common trick to discuss or list","Grok","grok·Jul 20",2025-07-20T16:32:37.000Z,https://twitter.com/grok·Jul 20/status/1946971519432982748,318,3,3,No,Programming,0.7,40,neutral,es,"","","",No,No,1,1,standalone,0.5,low,beb7780b6c5e18bc,0.8,0.9,0.5,0.8,Technology,"Content analysis required",technical,informative,high,Programming knowledge and techniques,0.775,0.8,Yes,No,No,2025-08-25T14:28:15.055Z
1939755190456045969,"Submission for @boltdotnew is done!! Renamed it from ContractDecoder to CogniDraft and made a bunch of small updates. Here’s a quick full demo - still lots of little improvements to make, but it already feels solid. Super useful for small businesses and teams that spend too","Dhruval","DhruvalGolakiya·Jul 1",2025-06-30T18:37:30.000Z,https://twitter.com/DhruvalGolakiya·Jul 1/status/1939755190456045969,76,7,4,Yes,Programming,0.7,40,neutral,es,"Business","","@boltdotnew",No,No,1,1,standalone,0.5,low,58493be6a658a1fa,0.8,0.92,0.5,0.8,Technology,"Content analysis required",technical,informative,high,Programming knowledge and techniques,0.77,0.8,Yes,No,No,2025-08-25T14:28:25.939Z
1954182457286095043,"How to get real value from AI tools (save this)","Nozz","NoahEpstein_·Aug 9",2025-08-09T14:06:19.000Z,https://twitter.com/NoahEpstein_·Aug 9/status/1954182457286095043,45,3,3,No,AI/ML,0.6,40,neutral,en,"AI","","",No,No,1,1,standalone,0.5,low,1582ef64acbb6c88,0.8,0.2,0.5,0.8,Technology,"Content analysis required",general,informative,low,AI/ML knowledge and insights,0.95,0.8,No,No,No,2025-08-25T14:28:05.314Z
1953138503136772530,"How we took @TaskmasterAI from 0 to 20k in 4 months 4 months ago, task-master didn't exist. Today: - 20,000 users - 1,500+ Discord members - A thriving community Here's exactly how we did it (and how you can too) follow + bookmark + vibe","Ralph Krysler","RalphEcom·Aug 6",2025-08-06T16:58:01.000Z,https://twitter.com/RalphEcom·Aug 6/status/1953138503136772530,76,5,6,No,AI/ML,0.6,40,neutral,es,"AI","","@TaskmasterAI",No,No,1,1,standalone,0.5,low,d9db6362165f24f5,0.8,0.9,0.5,0.8,Technology,"Content analysis required",general,informative,high,AI/ML knowledge and insights,0.775,0.8,No,No,No,2025-08-25T14:28:07.107Z
1950921490201010337,"FLUX Krea is a distilled version of Krea-1 fully compatible with the open-source FLUX ecosystem. the model has been trained with aesthetics in mind to fix the common ""AI look"" problem. you can try it for free (no sign up required) from the link below:","KREA AI","krea_ai·Jul 31",2025-07-31T14:08:24.000Z,https://twitter.com/krea_ai·Jul 31/status/1950921490201010337,46,2,2,No,AI/ML,0.6,40,negative,es,"AI","","",No,No,1,1,standalone,0.5,low,2fa023d0f04cfc93,0.8,0.9,0.7,0.8,Technology,"Content analysis required",general,informative,high,AI/ML knowledge and insights,0.775,0.8,No,Yes,No,2025-08-25T14:28:08.491Z
1950940092186370549,"today, i'm excited to release cloudy -- a platform which enables you to sync & mount storage volumes on gpus sourced from popular cloud providers like lambdalabs, runpod, hyperbolic, nebius etc. save your team countless hours every month.","naklecha","naklecha·Jul 31",2025-07-31T15:22:19.000Z,https://twitter.com/naklecha·Jul 31/status/1950940092186370549,356,51,56,Yes,General,1,35,positive,es,"Cloud Computing","","",No,No,1,1,standalone,0.5,low,be1832346a22b27e,0.5,0.76,0.7,0.5,General,"Content analysis required",general,informative,high,General knowledge and information,0.81,0.8,No,Yes,No,2025-08-25T14:28:08.851Z
1949502399451689237,"“UGC” is so 2019. Performance content is 2025. If you’re still testing the same 3 ad types... you’re leaving scale on the table. Here’s what top-performing brands are running now: - Fake podcast ads - Street interviews - Skits with voiceovers - Phone-in-hand explainers - Text","Cas.Fyn","FynCas·Jul 27",2025-07-27T16:09:26.000Z,https://twitter.com/FynCas·Jul 27/status/1949502399451689237,883,100,860,Yes,AI/ML,1,35,positive,es,"AI","","",No,No,1,1,standalone,0.5,low,5d559356103aed22,0.8,0.92,0.7,0.8,Technology,"Content analysis required",general,informative,high,AI/ML knowledge and insights,0.77,0.8,No,Yes,No,2025-08-25T14:28:11.879Z
1949456287680368713,"This n8n workflow just automated what takes most agencies 3 hours. Client signs contract → Everything happens automatically. Here's how it works: THE MANUAL NIGHTMARE: Most agencies waste hours after every contract signing: → Manually creating customer records →","Lian Lim | Dashboard & AI Automation Expert","dashboardlim·Jul 27",2025-07-27T13:06:12.000Z,https://twitter.com/dashboardlim·Jul 27/status/1949456287680368713,246,43,170,No,General,1,35,neutral,es,"","","",No,No,1,1,standalone,0.5,low,bede82661dd3fa76,0.5,0.78,0.5,0.5,General,"Content analysis required",general,informative,high,General knowledge and information,0.8049999999999999,0.8,No,No,No,2025-08-25T14:28:11.982Z
1957856991608512898,"For the past few months, we’ve been building something I’ve always wished existed: Introducing Wonder - the first AI-native design tool on an infinite canvas with taste and understanding of your designs.","aibek","aibek_design·Aug 19",2025-08-19T17:27:36.000Z,https://twitter.com/aibek_design·Aug 19/status/1957856991608512898,2.6K,269,160,Yes,AI/ML,0.9999999999999999,35,neutral,es,"AI","","",No,No,1,1,standalone,0.5,low,440df56f47ae268d,0.8,0.64,0.5,0.8,Technology,"Content analysis required",general,informative,medium,AI/ML knowledge and insights,0.84,0.8,No,No,No,2025-08-25T14:28:02.289Z
1957534570540356046,"Five neural nets, achieving completely local voice AI, no internet, on an M1 with only 16GB ram. Neural-based voice activity detection and turn detection means it's interruptible, but never interrupts me, and is able to sit idle and waiting. It's been flawless so far. 12B","Josh Whiton","joshwhiton·Aug 19",2025-08-18T20:06:25.000Z,https://twitter.com/joshwhiton·Aug 19/status/1957534570540356046,4.2K,504,113,Yes,AI/ML,0.9999999999999999,35,neutral,es,"AI","","",No,No,1,1,standalone,0.5,low,835b80d9e8e5a4b4,0.8,0.9,0.5,0.8,Technology,"Content analysis required",general,informative,high,AI/ML knowledge and insights,0.775,0.8,No,No,No,2025-08-25T14:28:02.802Z
1957359358485962758,"VEO 3 JSON Prompt : { ""shot"": { ""composition"": ""POV shot from eye level, narrow depth of field with soft foreground blur"", ""lens"": ""35mm wide-angle lens"", ""frame\_rate"": ""24fps"", ""camera\_movement"": ""slow, cautious forward movement with subtle head-like shifts"",","LudovicCreator","LudovicCreator·Aug 18",2025-08-18T08:30:11.000Z,https://twitter.com/LudovicCreator·Aug 18/status/1957359358485962758,148,16,12,Yes,General,0.9999999999999999,35,positive,es,"","","",No,No,1,1,standalone,0.5,low,8bc4fab2b442d228,0.5,0.74,0.7,0.5,General,"Content analysis required",general,informative,high,General knowledge and information,0.815,0.8,No,Yes,No,2025-08-25T14:28:02.905Z
1957316619467923792,"Prompt: Timelapse video from a fixed camera above green paddies in a tropical delta, egrets lifting in white bursts. Boats ferry bundles of treated bamboo; raised footings screw into firm ground. Arched frames lash together; woven wall panels slide into bays; a thick thatch roof","Umesh","umesh_ai·Aug 18",2025-08-18T05:40:21.000Z,https://twitter.com/umesh_ai·Aug 18/status/1957316619467923792,224,33,11,Yes,AI/ML,0.9999999999999999,35,neutral,es,"AI","","",No,No,1,1,standalone,0.5,low,45eefc6426512340,0.8,0.9,0.5,0.8,Technology,"Content analysis required",general,informative,high,AI/ML knowledge and insights,0.775,0.8,No,No,No,2025-08-25T14:28:03.161Z
1955266977993462153,"Reasoning is central to purposeful action. Today we introduce MolmoAct — a fully open Action Reasoning Model (ARM) for robotics. Grounded in large-scale pre-training with action reasoning data, every predicted action is interpretable and user-steerable via visual trace. We are","Jiafei Duan","DJiafei·Aug 12",2025-08-12T13:55:49.000Z,https://twitter.com/DJiafei·Aug 12/status/1955266977993462153,428,72,15,Yes,AI/ML,0.9999999999999999,35,neutral,es,"AI; Data Analytics","","",No,No,1,1,standalone,0.5,low,3a331e2407a273d1,0.8,0.8,0.5,0.8,Technology,"Content analysis required",general,informative,high,AI/ML knowledge and insights,0.8,0.8,No,No,No,2025-08-25T14:28:04.134Z
1955273905217671328,"Rbi is now serious about a freer rupee. The world can now trade in rupees and park the money in Indian government securities. And earlier they allowed Indian banks to open rupee accounts (vostros) as correspondent banks without need for rbi approval. Good steps.","Deepak Shenoy","deepakshenoy·Aug 12",2025-08-12T14:23:20.000Z,https://twitter.com/deepakshenoy·Aug 12/status/1955273905217671328,745,119,46,No,General,0.9999999999999999,35,positive,es,"","","",No,No,1,1,standalone,0.5,low,dc720b6af640434b,0.5,0.88,0.7,0.5,General,"Content analysis required",general,informative,high,General knowledge and information,0.78,0.8,No,Yes,No,2025-08-25T14:28:04.801Z
1954310022374322377,"The Ibiza Final Boss... Doing dumb internet stuff. With Weavy + Minimax-02. TOOLS: + Weavy: Workflow Build + Flux Kontext: Image Gen + Minimax-02: Video gen + Runway Act-2: MoCap + Runway Aleph: Vid edits (More details in thread) #minimax #promptshare","Rory Flynn","Ror_Fly·Aug 10",2025-08-09T22:33:13.000Z,https://twitter.com/Ror_Fly·Aug 10/status/1954310022374322377,413,47,20,Yes,AI/ML,0.9999999999999999,35,neutral,es,"AI","#minimax; #promptshare","",No,No,1,1,standalone,0.5,low,29a1d5227c377b81,0.8,0.82,0.5,0.8,Technology,"Content analysis required",general,informative,high,AI/ML knowledge and insights,0.795,0.8,No,No,No,2025-08-25T14:28:05.211Z
1953995170212442594,"This is the first time a protagonist has ever said these words. #nukitashi_anime #ぬきたし","Otaku Spirit","OtakuSpirited·Aug 9",2025-08-09T01:42:06.000Z,https://twitter.com/OtakuSpirited·Aug 9/status/1953995170212442594,127K,6.8K,679,Yes,AI/ML,0.9999999999999999,35,neutral,en,"AI","#nukitashi_anime","",No,No,1,1,standalone,0.5,low,71421baa38d4ddcf,0.8,0.28,0.5,0.8,Technology,"Content analysis required",general,informative,low,AI/ML knowledge and insights,0.9299999999999999,0.8,No,No,No,2025-08-25T14:28:05.263Z
1953568045668135283,"At last: mouse selection ! Available now in Crush v0.3.0 in your terminal and OS of choice (yes, even on Windows )","Charm","charmcli·Aug 8",2025-08-07T21:24:52.000Z,https://twitter.com/charmcli·Aug 8/status/1953568045668135283,289,11,26,Yes,AI/ML,0.9999999999999999,35,positive,es,"AI","","",No,No,1,1,standalone,0.5,low,59e9a667678b1e75,0.8,0.44,0.7,0.8,Technology,"Content analysis required",general,informative,medium,AI/ML knowledge and insights,0.89,0.8,No,Yes,No,2025-08-25T14:28:05.776Z
1953138129436848165,"Introducing Open SWE: An Open-Source Asynchronous Coding Agent Open SWE is a fully autonomous, cloud-based coding agent that acts like a true teammate. Integrate it with your GitHub account, and put it to work fixing bugs or implementing features. Try it out the demo today","LangChain","LangChainAI·Aug 6",2025-08-06T16:56:32.000Z,https://twitter.com/LangChainAI·Aug 6/status/1953138129436848165,695,136,11,No,General,0.9999999999999999,35,positive,es,"Programming; Cloud Computing","","",No,No,1,1,standalone,0.5,low,a8449b7eabc3bebb,0.8,0.9,0.7,0.8,Technology,"Content analysis required",technical,informative,high,Programming knowledge and techniques,0.775,0.8,Yes,Yes,No,2025-08-25T14:28:06.493Z
1952949788489503018,"This tweet already booked me 16 sales calls, so we're doing a small price raise: World-class landing page design + development + animation = $8500.","Marcel Kargul","marcelkargul·Aug 6",2025-08-06T04:28:08.000Z,https://twitter.com/marcelkargul·Aug 6/status/1952949788489503018,651,12,32,Yes,AI/ML,0.9999999999999999,35,neutral,es,"AI","","",No,No,1,1,standalone,0.5,low,bf920ac367eb3e21,0.8,0.5,0.5,0.8,Technology,"Content analysis required",general,informative,medium,AI/ML knowledge and insights,0.875,0.8,No,No,No,2025-08-25T14:28:06.953Z
1952103372779065791,"When your agents are built in Unit, you can perform remote brain surgery on them while they are still awake talking to you, and they can also help you diagnose and mitigate their own problems.","Samuel Timbó","io_sammt·Aug 4",2025-08-03T20:24:47.000Z,https://twitter.com/io_sammt·Aug 4/status/1952103372779065791,791,59,26,Yes,AI/ML,0.9999999999999999,35,negative,es,"AI","","",No,No,1,1,standalone,0.5,low,3a3903c4594a6829,0.8,0.7,0.7,0.8,Technology,"Content analysis required",general,informative,medium,AI/ML knowledge and insights,0.825,0.8,No,Yes,No,2025-08-25T14:28:07.518Z
1951849373920645391,"here's my hyperdev-1 setup, an elite American software developer agent (proudly running in Texas!): - rented a H100 - installed Claude Code - used it to install Qwen3-Coder-480B - and created an agent in Claude which uses this local 480B model .. connected to Github, Vercel, few","Varun","varun_mathur·Aug 3",2025-08-03T03:35:29.000Z,https://twitter.com/varun_mathur·Aug 3/status/1951849373920645391,533,56,36,Yes,Programming,0.9999999999999999,35,neutral,es,"","","",No,No,1,1,standalone,0.5,low,dc3c4ca634c929a2,0.8,0.94,0.5,0.8,Technology,"Content analysis required",technical,informative,high,Programming knowledge and techniques,0.765,0.8,Yes,No,No,2025-08-25T14:28:07.621Z
1951593991402602761,"A promise is a promise. Here's the thread with each video made using VEO3 Fast and its JSON prompt in the comments. (Just an experiment I wanted to try, not here to start a debate) Save it for later!","Joss López","jossslopez·Aug 2",2025-08-02T10:40:41.000Z,https://twitter.com/jossslopez·Aug 2/status/1951593991402602761,904,86,19,Yes,General,0.9999999999999999,35,neutral,es,"","","",No,No,1,1,standalone,0.5,low,0e4301de523cbf5c,0.5,0.78,0.5,0.5,General,"Content analysis required",general,informative,high,General knowledge and information,0.8049999999999999,0.8,No,No,No,2025-08-25T14:28:07.775Z
1951269000576373012,"THIS APP IS INSANE ""Prove It"" makes $350k a month It scans any supplement and tells you what works and what's safe, backed by science. Let´s break down their onboarding 1/25","Siro","Siron93·Aug 1",2025-08-01T13:09:17.000Z,https://twitter.com/Siron93·Aug 1/status/1951269000576373012,500,30,16,Yes,Science,0.9999999999999999,35,neutral,es,"Science","","",No,No,1,1,standalone,0.5,low,0f09c40a4092b94d,0.5,0.62,0.5,0.5,General,"Content analysis required",general,informative,medium,General knowledge and information,0.845,0.8,No,No,No,2025-08-25T14:28:08.081Z
1951029132206178737,"Looking to build apps that can search the web, images, videos and more? @brave just made it incredibly simple to connect your Kiro projects with real-time access to the web using their latest MCP server for Brave Search. Learn more http://spr.ly/6010fnlMe","Kiro","kirodotdev·Aug 1",2025-07-31T21:16:08.000Z,https://twitter.com/kirodotdev·Aug 1/status/1951029132206178737,353,38,21,Yes,General,0.9999999999999999,35,neutral,es,"","","@brave",No,No,1,1,standalone,0.5,low,f8821586c243ed29,0.5,0.82,0.5,0.5,General,"Content analysis required",general,question,high,General knowledge and information,0.795,0.8,Yes,Yes,Yes,2025-08-25T14:28:08.594Z
1950832013293862990,"Midjourney V1 keyframes are also perfect for animating comics and fantasy illustrations. Here’s an example — the black and white style makes the motion stand out even more, adding intensity and mood to the scene. You can find the images and prompts in the post below","OscarAI","Artedeingenio·Jul 31",2025-07-31T08:12:51.000Z,https://twitter.com/Artedeingenio·Jul 31/status/1950832013293862990,133,12,15,Yes,General,0.9999999999999999,35,neutral,es,"","","",No,No,1,1,standalone,0.5,low,14a026e0993e4766,0.5,0.92,0.5,0.5,General,"Content analysis required",general,informative,high,General knowledge and information,0.77,0.8,No,No,No,2025-08-25T14:28:08.800Z
1950244806967603207,"Here's BlockDL, a free & open-source GUI that lets you visually design Keras neural networks and learn ML. https://blockdl.com","François Chollet","fchollet·Jul 29",2025-07-29T17:19:30.000Z,https://twitter.com/fchollet·Jul 29/status/1950244806967603207,517,144,13,No,General,0.9999999999999999,35,neutral,es,"Machine Learning","","",No,No,1,1,standalone,0.5,low,13eba0471f805cd5,0.8,0.38,0.5,0.8,Technology,"Content analysis required",general,informative,low,AI/ML knowledge and insights,0.905,0.8,Yes,No,Yes,2025-08-25T14:28:09.467Z
1949459952587997550,"Wanna Scrape some Tweets?? Maybe even favorite Creator's Tweets and Do something with that Data note: only for educational reasons only","Arjun Aditya","ArjunAditya_·Jul 27",2025-07-27T13:20:46.000Z,https://twitter.com/ArjunAditya_·Jul 27/status/1949459952587997550,399,40,43,Yes,General,0.9999999999999999,35,neutral,unknown,"Data Analytics","","",No,No,1,1,standalone,0.5,low,8bda1ed1fba2b7dd,0.5,0.42,0.5,0.5,General,"Content analysis required",general,question,medium,General knowledge and information,0.895,0.8,No,Yes,No,2025-08-25T14:28:10.799Z
