ID,Text,Author,Author Handle,Timestamp,URL,Like Count,Retweet Count,Reply Count,Has Media,Content Type,Engagement Score,Priority Score,Sentiment,Language,Topics,Hashtags,Mentions,Thread Start,Thread Part,Thread Length,Thread Position,Thread Context,Thread Engagement,Thread Complexity,Content Hash,Relevance Score,Quality Score,Engagement Potential,Learning Value,Knowledge Category,Key Insights,Target Audience,Information Type,Content Value,Bookmark Context,Readability Score,Extraction Confidence,Actionable,Discussion Worthy,Reference Worthy,Processed At
1957792907269927230,"In 6 months, running a business without AI having full context will seem insane. I built mine last week. Claude sees my CRM, calls, emails, analytics - everything. Here's the full setup","Tom","tomcrawshaw01·Aug 19",2025-08-19T13:12:57.000Z,https://twitter.com/tomcrawshaw01·Aug 19/status/1957792907269927230,375,39,110,No,AI/ML,1,65,neutral,es,"AI; Business; Data Analytics","","",No,No,1,1,standalone,0.5,low,8065ff55476b4ea4,0.8,0.64,0.5,0.8,Technology,"Content analysis required",business,informative,medium,AI/ML knowledge and insights,0.84,0.8,No,No,No,2025-08-25T14:28:01.878Z
1952029877185712393,"Just built a Voice AI Chatbot that lets customers talk to your business and get real answers from your docs. Sold the setup for $3,000 + $750/mo and it’s already answering calls for multiple businesses Here’s what it does: – Lets users ask questions via voice (like: “Do you","Subhaghvs","SubhaghV·Aug 3",2025-08-03T15:32:44.000Z,https://twitter.com/SubhaghV·Aug 3/status/1952029877185712393,527,229,311,No,AI/ML,1,60,positive,en,"AI; Business","","",No,No,1,1,standalone,0.5,low,3894d3da8885d655,0.8,0.98,0.7,0.8,Technology,"Content analysis required",business,informative,high,AI/ML knowledge and insights,0.755,0.8,No,Yes,No,2025-08-25T14:28:07.672Z
1949818572429017453,"Add Semantic Search to Claude Code! Code Context is an MCP plugin that adds semantic code search to Claude Code and other AI coding agents, giving them deep context from your entire codebase. It's 100% Open Source","Sumanth","Sumanth_077·Jul 28",2025-07-28T13:05:48.000Z,https://twitter.com/Sumanth_077·Jul 28/status/1949818572429017453,514,85,19,No,AI/ML,0.8999999999999999,60,neutral,es,"AI; Programming","","",No,No,1,1,standalone,0.5,low,c6012a3bdb8e7ce6,0.8,0.74,0.5,0.8,Technology,"Content analysis required",technical,informative,high,AI/ML knowledge and insights,0.815,0.8,Yes,No,No,2025-08-25T14:28:10.492Z
1955312558652760266,"If you're a designer vibe coding software with Cursor, Windsurf, or Claude code and you're tired of your UI just being AI slop... Take a look at my workflow for getting my designs from Figma into actual code for my web app.","Sam Lane","Sam_Lane96·Aug 12",2025-08-12T16:56:56.000Z,https://twitter.com/Sam_Lane96·Aug 12/status/1955312558652760266,341,12,10,No,AI/ML,0.7999999999999999,60,positive,en,"AI; Programming","","",No,No,1,1,standalone,0.5,low,a5ef4f649b04c909,0.8,0.84,0.7,0.8,Technology,"Content analysis required",technical,informative,high,AI/ML knowledge and insights,0.79,0.8,Yes,Yes,No,2025-08-25T14:28:04.390Z
1958558278008586519,"We're open sourcing v2 of our Perplexity clone in 24 hours Ask any question and get AI-powered answers with images and cited sources, all powered by /v2 our search and scrape endpoints. Powered by @firecrawl_dev and @aisdk","Eric Ciarla (hiring)","ericciarla·Aug 21",2025-08-21T15:54:16.000Z,https://twitter.com/ericciarla·Aug 21/status/1958558278008586519,441,47,28,Yes,AI/ML,0.9999999999999999,55,neutral,es,"AI","","@firecrawl_dev; @aisdk",No,No,1,1,standalone,0.5,low,1ab865ec674ab3f0,0.8,0.74,0.5,0.8,Technology,"Content analysis required",general,informative,high,AI/ML knowledge and insights,0.815,0.8,No,No,No,2025-08-25T14:28:01.621Z
1957850628299837667,"What if you could watch a UI generate in real-time as you work with AI? Now you can, with Real Time UI in MagicPath. This is extremely hard to do, especially for interactive React components with states. That’s why you don’t see this anywhere else. This is a first.","Pietro Schirano","skirano·Aug 19",2025-08-19T17:02:19.000Z,https://twitter.com/skirano·Aug 19/status/1957850628299837667,415,43,43,Yes,AI/ML,0.9999999999999999,55,negative,en,"AI","","",No,No,1,1,standalone,0.5,low,ff492f83747a5961,0.8,0.98,0.5,0.8,Technology,"Content analysis required",general,question,high,AI/ML knowledge and insights,0.755,0.8,No,Yes,No,2025-08-25T14:28:01.929Z
1957847823585820937,"Big update: we’re building an AI device that looks like jewelry, not another screen or plastic gadget. Yes, hardware is hard. But AI doesn’t belong in a browser forever. More soon. Follow along","elena","eleelenawa·Aug 19",2025-08-19T16:51:10.000Z,https://twitter.com/eleelenawa·Aug 19/status/1957847823585820937,264,15,49,Yes,AI/ML,0.9999999999999999,55,neutral,es,"AI","","",No,No,1,1,standalone,0.5,low,5a94313594d39a39,0.8,0.66,0.7,0.8,Technology,"Content analysis required",general,informative,medium,AI/ML knowledge and insights,0.835,0.8,No,Yes,No,2025-08-25T14:28:02.083Z
1957783710457020772,"Here's what @browsercompany's AI eng & ML teams are working on for @diabrowser right now: (This is a pitch to come work for us; info at end) COMPUTER USE – we've built our own bespoke APIs on top of Chromium to optimize latency, accuracy, and cost of computer-using agents.","Josh Miller","joshm·Aug 19",2025-08-19T12:36:25.000Z,https://twitter.com/joshm·Aug 19/status/1957783710457020772,509,40,45,Yes,AI/ML,0.9999999999999999,55,positive,unknown,"AI; Machine Learning","","@browsercompany; @diabrowser",No,No,1,1,standalone,0.5,low,f309eddf46ebaa38,0.8,0.98,0.7,0.8,Technology,"Content analysis required",business,informative,high,AI/ML knowledge and insights,0.755,0.8,No,Yes,No,2025-08-25T14:28:02.443Z
1948065575185584446,"CopyCat is the AI RPA. Companies, from enterprises to startups, are saving thousands of hours building browser agents to automate gov sites, legacy portals, and dashboards, where APIs can’t. Congrats on the launch, @GrahamSabin, @zyadelgoharyx & @a8hi_b! https://ycombinator.com/launches/O1l-copycat-the-ai-rpa-powered-by-browser-agents…","Y Combinator","ycombinator·Jul 23",2025-07-23T17:00:01.000Z,https://twitter.com/ycombinator·Jul 23/status/1948065575185584446,115,19,14,Yes,AI/ML,0.9999999999999999,55,neutral,es,"AI; Business","","@GrahamSabin; @zyadelgoharyx; @a8hi_b",No,No,1,1,standalone,0.5,low,16490ac4320097e7,0.8,0.76,0.5,0.8,Technology,"Content analysis required",business,informative,high,AI/ML knowledge and insights,0.81,0.8,Yes,No,Yes,2025-08-25T14:28:12.494Z
1943686987795382577,"I think i cracked the code on how to make real looking AI UGC for mobile apps Concept for Flo app (hire me)","Mugo | Paid Ads for Apps","MugoScales·Jul 11",2025-07-11T15:01:04.000Z,https://twitter.com/MugoScales·Jul 11/status/1943686987795382577,639,21,37,Yes,AI/ML,0.9999999999999999,55,neutral,es,"AI","","",No,No,1,1,standalone,0.5,low,520707429024024d,0.8,0.46,0.5,0.8,Technology,"Content analysis required",technical,informative,medium,AI/ML knowledge and insights,0.885,0.8,Yes,No,No,2025-08-25T14:28:20.609Z
1959354274775023897,"New era of science arXiv but for papers/science/research done by autonomous AIs. aiXiv - A Next Generation Open Access Ecosystem for Scientific Discovery Generated by AI Scientists Recent advances in large language models have enabled AI to generate research content, but","Dr Singularity","Dr_Singularity·Aug 24",2025-08-23T20:37:16.000Z,https://twitter.com/Dr_Singularity·Aug 24/status/1959354274775023897,337,84,22,No,AI/ML,0.8999999999999999,55,neutral,es,"AI; Science","","",No,No,1,1,standalone,0.5,low,a8dcd384fc3186cb,0.8,0.82,0.5,0.8,Technology,"Content analysis required",general,informative,high,AI/ML knowledge and insights,0.795,0.8,No,No,No,2025-08-25T14:28:00.948Z
1959083315878928808,"Congrats to Eric and the team at @genspark_ai for launching Genspark AI Developer! It's a zero-setup, complete IDE that runs in your browser, like Replit. You describe what you want, you get visual feedback and you and iterate on the output. You can pick your model (e.g. Claude","François Chollet","fchollet·Aug 23",2025-08-23T02:40:35.000Z,https://twitter.com/fchollet·Aug 23/status/1959083315878928808,404,42,15,No,AI/ML,0.8999999999999999,55,positive,es,"AI","","@genspark_ai",No,No,1,1,standalone,0.5,low,98ebd8c8cffa9304,0.8,0.96,0.7,0.8,Technology,"Content analysis required",technical,informative,high,AI/ML knowledge and insights,0.76,0.8,Yes,Yes,No,2025-08-25T14:28:01.256Z
1957789153048855037,"one of the most annoying parts of selling anything online is finding & dealing with a face for your product... this is also why one of the most profitable areas to automate with AI is content/creative generation, hence why i've been looking for a reliable AI UGC service for a","EP","apollonator3000·Aug 19",2025-08-19T12:58:02.000Z,https://twitter.com/apollonator3000·Aug 19/status/1957789153048855037,237,5,32,Yes,AI/ML,0.8999999999999999,55,neutral,en,"AI","","",No,No,1,1,standalone,0.5,low,d58042ccb46e4214,0.8,1,0.5,0.8,Technology,"Content analysis required",general,informative,high,AI/ML knowledge and insights,0.75,0.8,No,No,No,2025-08-25T14:28:02.186Z
1948426264559403204,"BREAKING: Doximity just released a free AI scribe for US clinicians, accelerating commoditization/the race to the bottom. With no plans to monetize, $DOCS puts pressure on startups like Abridge, Nabla, etc to move beyond notes -- into RCM, billing, compliance, & more.","Healthcare AI Guy","HealthcareAIGuy·Jul 24",2025-07-24T16:53:16.000Z,https://twitter.com/HealthcareAIGuy·Jul 24/status/1948426264559403204,186,22,18,No,AI/ML,0.8999999999999999,55,positive,es,"AI; Business","","",No,No,1,1,standalone,0.5,low,979580064893eed1,0.8,0.84,0.7,0.8,Technology,"Content analysis required",business,informative,high,AI/ML knowledge and insights,0.79,0.8,No,Yes,No,2025-08-25T14:28:12.135Z
1947707080955121996,"Claude Code has been game-changing for @AnthropicAI designers. We don’t just prototype, but we write production-level code. It’s in terminal, which might feel scary. But Claude makes it less so. Tips for getting started as a designer ↓","Meaghan","meag_han_c·Jul 22",2025-07-22T17:15:29.000Z,https://twitter.com/meag_han_c·Jul 22/status/1947707080955121996,821,57,40,No,AI/ML,0.8999999999999999,55,neutral,es,"AI","","@AnthropicAI",No,No,1,1,standalone,0.5,low,e683260a4e6364ab,0.8,0.76,0.5,0.8,Technology,"Content analysis required",technical,informative,high,AI/ML knowledge and insights,0.81,0.8,Yes,No,No,2025-08-25T14:28:13.621Z
1940025849002295569,"this might be my favorite AI dev stack so far: chatgpt → lovable → cursor + taskmaster + coderabbit chatgpt helps me plan lovable builds most of the MVP taskmaster keeps everything structured coderabbit vibe-checks every commit i'm building fast, staying sane, and having fun","Prajwal Tomar","PrajwalTomar_·Jul 1",2025-07-01T12:33:00.000Z,https://twitter.com/PrajwalTomar_·Jul 1/status/1940025849002295569,216,15,13,No,AI/ML,0.8999999999999999,55,neutral,es,"AI","","",No,No,1,1,standalone,0.5,low,06de153b9d10e0ed,0.8,0.9,0.5,0.8,Technology,"Content analysis required",technical,informative,high,AI/ML knowledge and insights,0.775,0.8,Yes,No,No,2025-08-25T14:28:25.733Z
1958541347906023710,"We just shipped Qoder and wow, this feels good. You know how Al tools nail the demo then completely lose it on your actual codebase? Yeah, we were tired of that too. So we created Qoder, The next-gen Agentic Coding Platform. It understands your whole codebase (Yes, even","Qoder","qoder_ai_ide·Aug 21",2025-08-21T14:46:59.000Z,https://twitter.com/qoder_ai_ide·Aug 21/status/1958541347906023710,787,307,111,Yes,AI/ML,1,50,neutral,es,"AI; Programming","","",No,No,1,1,standalone,0.5,low,6167427f8b73c418,0.8,0.96,0.7,0.8,Technology,"Content analysis required",technical,question,high,AI/ML knowledge and insights,0.76,0.8,Yes,Yes,No,2025-08-25T14:28:01.672Z
1956538069311500514,"ByteDance just opensourced a desktop automation AI Agent. This agent can use any desktop app, open files, and browse websites using vision models running locally. 100% Free, Opensource, and Local.","Unwind AI","unwind_ai_·Aug 16",2025-08-16T02:06:41.000Z,https://twitter.com/unwind_ai_·Aug 16/status/1956538069311500514,934,169,26,Yes,AI/ML,1,50,positive,es,"AI","","",No,No,1,1,standalone,0.5,low,8d7208dc22ceea5f,0.8,0.6,0.7,0.8,Technology,"Content analysis required",general,informative,medium,AI/ML knowledge and insights,0.85,0.8,No,Yes,No,2025-08-25T14:28:03.980Z
1953914547011825903,"BREAKING: You can now build AI agents that remember you. MemU is the first memory system designed for real-time, multi-modal AI companions. Here’s how it works (and how to integrate it):","Hasan Toor ✪","hasantoxr·Aug 9",2025-08-08T20:21:44.000Z,https://twitter.com/hasantoxr·Aug 9/status/1953914547011825903,960,129,62,No,AI/ML,1,50,neutral,es,"AI","","",No,No,1,1,standalone,0.5,low,5a45aae46d53ac95,0.8,0.62,0.5,0.8,Technology,"Content analysis required",general,informative,medium,AI/ML knowledge and insights,0.845,0.8,No,No,No,2025-08-25T14:28:05.622Z
1949886638009802825,"this framework makes sure your AI is giving accurate answers by catching hallucinations I just made a full walkthrough on how to evaluate if your AI system is actually working... inside I show: – how I track AI output with a simple dashboard – the key signals I watch to catch","Tyler","tyler_agg·Jul 28",2025-07-28T17:36:16.000Z,https://twitter.com/tyler_agg·Jul 28/status/1949886638009802825,165,15,128,Yes,AI/ML,1,50,neutral,es,"AI","","",No,No,1,1,standalone,0.5,low,a0ea94b07899ad80,0.8,1,0.5,0.8,Technology,"Content analysis required",general,informative,high,AI/ML knowledge and insights,0.745,0.8,No,No,Yes,2025-08-25T14:28:10.340Z
1949308553015263609,"Local voice AI with a 235 billion parameter LLM. - smart-turn v2 - MLX Whisper (large-v3-turbo-q4) - Qwen3-235B-A22B-Instruct-2507-3bit-DWQ - Kokoro All models running local on an M4 mac. Max RAM usage ~110GB. Voice-to-voice latency is ~950ms. There are a couple of","kwindla","kwindla·Jul 27",2025-07-27T03:19:10.000Z,https://twitter.com/kwindla·Jul 27/status/1949308553015263609,837,106,30,Yes,AI/ML,1,50,neutral,es,"AI; Machine Learning","","",No,No,1,1,standalone,0.5,low,8b182661bd1582e8,0.8,0.82,0.5,0.8,Technology,"Content analysis required",general,informative,high,AI/ML knowledge and insights,0.795,0.8,No,No,No,2025-08-25T14:28:11.570Z
1953568079176225131,"A client of mine had a wild idea today: “Let’s sell milk udders.” naturally, I used Veo 3 and this new AI sourcing tool called Accio to bring it to life here’s how I went from utter nonsense to full production in a few steps:","Salma","Salmaaboukarr·Aug 8",2025-08-07T21:25:00.000Z,https://twitter.com/Salmaaboukarr·Aug 8/status/1953568079176225131,398,36,25,Yes,AI/ML,0.9999999999999999,50,neutral,unknown,"AI","","",No,No,1,1,standalone,0.5,low,a19a4b24bb24c0a5,0.8,0.9,0.5,0.8,Technology,"Content analysis required",general,informative,high,AI/ML knowledge and insights,0.775,0.8,No,No,No,2025-08-25T14:28:05.982Z
1951572950508810682,"A lot of people have been asking me how I made this AI video, with consistent characters, styles, and realistic lip sync. I’m breaking it all down for you in this thread","TechHalla","techhalla·Aug 2",2025-08-02T09:17:04.000Z,https://twitter.com/techhalla·Aug 2/status/1951572950508810682,740,73,40,Yes,AI/ML,0.9999999999999999,50,neutral,es,"AI","","",No,No,1,1,standalone,0.5,low,9b495c0fd01044a5,0.8,0.64,0.5,0.8,Technology,"Content analysis required",general,informative,medium,AI/ML knowledge and insights,0.84,0.8,No,No,No,2025-08-25T14:28:07.723Z
1950993407373164727,"People are wildly underestimating how entertaining it is for AI to write & produce a story FOR you. I put ""Sam Altman tries to convince Kim K to promote GPT-5"" into Showrunner (@fablesimulation) and got this The product handles the script, images, voices, and animation.","Justine Moore","venturetwins·Aug 1",2025-07-31T18:54:10.000Z,https://twitter.com/venturetwins·Aug 1/status/1950993407373164727,401,42,35,Yes,AI/ML,0.9999999999999999,50,neutral,es,"AI","","@fablesimulation",No,No,1,1,standalone,0.5,low,b55aa1f1cb5d676d,0.8,0.9,0.5,0.8,Technology,"Content analysis required",general,informative,high,AI/ML knowledge and insights,0.775,0.8,No,No,No,2025-08-25T14:28:08.286Z
1949765805920403501,"Yesterday I made this short film-ad for a personal project I’m working on. Used @GoogleAI Flow, @elevenlabsio , @grok and @SunoMusic Ai Created the script on one side with a clear idea Music “composed” with specific intent Suno Google Flow produces clips of max 8s so I had","Pedro Orlando","orlandopedro_·Jul 28",2025-07-28T09:36:07.000Z,https://twitter.com/orlandopedro_·Jul 28/status/1949765805920403501,130,20,23,Yes,AI/ML,0.9999999999999999,50,neutral,es,"AI","","@GoogleAI; @elevenlabsio; @grok; @SunoMusic",No,No,1,1,standalone,0.5,low,3cc7756b50703019,0.8,0.96,0.5,0.8,Technology,"Content analysis required",general,informative,high,AI/ML knowledge and insights,0.76,0.8,No,No,No,2025-08-25T14:28:10.134Z
1956899966586073418,"YOU KNOW WHAT ITS MY BIRTHDAY WE ARE OPEN SOURCING THE SUPERMEMORY APP AGAIN MIT LICENSED ENJOY. DESTROY MY STARTUP https://Git.new/memory","Dhravya Shah","DhravyaShah·Aug 17",2025-08-17T02:04:44.000Z,https://twitter.com/DhravyaShah·Aug 17/status/1956899966586073418,560,15,44,No,AI/ML,0.8999999999999999,50,neutral,es,"AI; Business","","",No,No,1,1,standalone,0.5,low,c49e51cfcd1ba3b3,0.8,0.42,0.5,0.8,Technology,"Content analysis required",business,informative,medium,AI/ML knowledge and insights,0.895,0.8,Yes,No,Yes,2025-08-25T14:28:03.672Z
1954458002469073253,"Apple’s Embedding Atlas (MIT license) lets you explore, cluster, search, and filter millions of points in real time with WebGPU. Great for AI, data science, and research. Demo: apple.github .io/embedding-atlas Source: github .com/apple/embedding-atlas","Leon","LeonWohlgemuth·Aug 10",2025-08-10T08:21:14.000Z,https://twitter.com/LeonWohlgemuth·Aug 10/status/1954458002469073253,561,78,4,Yes,AI/ML,0.8999999999999999,50,positive,es,"AI; Science; Data Analytics","","",No,No,1,1,standalone,0.5,low,877f96e469981c6f,0.8,0.66,0.7,0.8,Technology,"Content analysis required",general,informative,medium,AI/ML knowledge and insights,0.835,0.8,No,Yes,No,2025-08-25T14:28:04.956Z
1953116450044166290,"why I’m devoting my life, youth, ATP, and GPU hours to Precigenetics: forget about what the name stands for. think from first principles drug discovery is completely overfit to a world without AI. we are not developing drugs rationally, which is why we are still fighting","Parmita Mishra","prmshra·Aug 6",2025-08-06T15:30:23.000Z,https://twitter.com/prmshra·Aug 6/status/1953116450044166290,360,67,33,No,AI/ML,0.8999999999999999,50,neutral,unknown,"AI","","",No,No,1,1,standalone,0.5,low,565d4fdc164cf44b,0.8,0.92,0.5,0.8,Technology,"Content analysis required",general,informative,high,AI/ML knowledge and insights,0.77,0.8,No,No,No,2025-08-25T14:28:06.748Z
1951654060345401592,"The best engineers I talk to say the same thing... ""A 1x engineer with AI is a 0.1x engineer but a 10x engineer with AI is 100x engineer."" So I asked our engineers at @tenex_labs what is the biggest difference between a .1x and 100x engineer. Here's what they said: 1)","Alex Lieberman","businessbarista·Aug 2",2025-08-02T14:39:22.000Z,https://twitter.com/businessbarista·Aug 2/status/1951654060345401592,316,49,22,No,AI/ML,0.8999999999999999,50,positive,en,"AI","","@tenex_labs",No,No,1,1,standalone,0.5,low,fc4d3ac7ffdee619,0.8,1,0.7,0.8,Technology,"Content analysis required",general,informative,high,AI/ML knowledge and insights,0.745,0.8,No,Yes,Yes,2025-08-25T14:28:07.876Z
1950443752608412090,"I have tested 100+ MCP servers in the last 3 months! Let's use the best 6 to build an ultimate AI assistant for devs (100% local):","Avi Chawla","_avichawla·Jul 30",2025-07-30T06:30:02.000Z,https://twitter.com/_avichawla·Jul 30/status/1950443752608412090,826,69,16,No,AI/ML,0.8999999999999999,50,positive,es,"AI","","",No,No,1,1,standalone,0.5,low,7587f55d0330d702,0.8,0.52,0.7,0.8,Technology,"Content analysis required",general,informative,medium,AI/ML knowledge and insights,0.87,0.8,No,Yes,No,2025-08-25T14:28:09.365Z
1949866505040175170,"Connect Kimi K2 to live docs for 30,000 popular frameworks Most AI coding assistants, while impressive, have a significant gap — outdated implementation knowledge. I spend this weekend building a new open source project to fix that: Meet CodeWizard, Kimi K2 running fast on","Ben Klieger","benklieger·Jul 28",2025-07-28T16:16:16.000Z,https://twitter.com/benklieger·Jul 28/status/1949866505040175170,135,25,7,Yes,AI/ML,0.8999999999999999,50,neutral,es,"AI; Programming","","",No,No,1,1,standalone,0.5,low,11cac2801350e680,0.8,0.88,0.5,0.8,Technology,"Content analysis required",technical,informative,high,AI/ML knowledge and insights,0.78,0.8,Yes,No,No,2025-08-25T14:28:09.672Z
1949849412806508810,"THIS APP IS WILD Promova is making $750K/month by combining AI role-play, expert courses, and live tutors into a single, seamless experience. Let's break down their onboarding 1/19","Siro","Siron93·Jul 28",2025-07-28T15:08:21.000Z,https://twitter.com/Siron93·Jul 28/status/1949849412806508810,412,29,5,Yes,AI/ML,0.8999999999999999,50,neutral,es,"AI; Machine Learning","","",No,No,1,1,standalone,0.5,low,2f4aedee13e2ecb0,0.8,0.56,0.5,0.8,Technology,"Content analysis required",general,informative,medium,AI/ML knowledge and insights,0.86,0.8,No,No,No,2025-08-25T14:28:09.723Z
1949857596514439412,"You need to master 5 things to become an AI PM. Here's your complete roadmap (free): AI PDLC - 5:35 Predictive v Generative - 23:10 Contextualization - 50:24 AI Agents - 1:03:40 Portfolio - 1:11:37","Aakash Gupta","aakashg0·Jul 28",2025-07-28T15:40:52.000Z,https://twitter.com/aakashg0·Jul 28/status/1949857596514439412,328,68,10,Yes,AI/ML,0.8999999999999999,50,neutral,es,"AI","","",No,No,1,1,standalone,0.5,low,0fece72257bc0d17,0.8,0.7,0.5,0.8,Technology,"Content analysis required",general,informative,medium,AI/ML knowledge and insights,0.825,0.8,No,No,No,2025-08-25T14:28:09.775Z
1949891358233182628,"Introducing ""AI for Advertising"" A 10-part series on how to use @runwayml throughout the entire creative process:","WVI","Runway",2025-07-28T17:55:01.000Z,https://twitter.com/Runway/status/1949891358233182628,262,40,13,No,AI/ML,0.8999999999999999,50,neutral,es,"AI; Machine Learning","","@runwayml",No,No,1,1,standalone,0.5,low,37b42b073892b457,0.8,0.34,0.5,0.8,Technology,"Content analysis required",general,informative,low,AI/ML knowledge and insights,0.915,0.8,No,No,No,2025-08-25T14:28:10.186Z
1949135449634513368,"Here’s a thread on Semantic Zoom — a UI design pattern that is becoming prominent in the design scene with AIs enabling multi-level text summaries.","Prathyush","prathyvsh·Jul 26",2025-07-26T15:51:19.000Z,https://twitter.com/prathyvsh·Jul 26/status/1949135449634513368,302,42,10,Yes,AI/ML,0.8999999999999999,50,neutral,es,"AI","","",No,No,1,1,standalone,0.5,low,a3c961e18a36e457,0.8,0.5,0.5,0.8,Technology,"Content analysis required",general,informative,medium,AI/ML knowledge and insights,0.875,0.8,No,No,No,2025-08-25T14:28:11.262Z
1957089860248105365,"Today, most AI agents run every task no matter how simple through massive LLMs like GPT-4 or Claude. NVIDIA’s researchers say: that’s wasteful, unnecessary, and about to change. Small Language Models (SLMs) are models that fit on consumer hardware and run with low latency.","Ihtesham Haider","ihteshamit·Aug 17",2025-08-17T14:39:18.000Z,https://twitter.com/ihteshamit·Aug 17/status/1957089860248105365,365,31,6,No,AI/ML,0.7999999999999999,50,neutral,es,"AI; Science","","",No,No,1,1,standalone,0.5,low,9d8020b1edef3090,0.8,0.88,0.7,0.8,Technology,"Content analysis required",general,informative,high,AI/ML knowledge and insights,0.78,0.8,No,Yes,No,2025-08-25T14:28:03.008Z
1950443834363846697,"Today, we'll build a local ultimate AI assistant using: - @mcpuse to connect LLM to MCP servers - @Stagehanddev MCP for browser access - @firecrawl_dev MCP for scraping - @ragieai MCP for multimodal RAG - @zep_ai Graphiti MCP as memory - Terminal & GitIngest MCP Let's dive in!","Avi Chawla","_avichawla·Jul 30",2025-07-30T06:30:22.000Z,https://twitter.com/_avichawla·Jul 30/status/1950443834363846697,115,8,2,Yes,AI/ML,0.7999999999999999,50,neutral,es,"AI","","@mcpuse; @Stagehanddev; @firecrawl_dev; @ragieai; @zep_ai",No,No,1,1,standalone,0.5,low,4d480094d2ca51c3,0.8,0.96,0.5,0.8,Technology,"Content analysis required",general,informative,high,AI/ML knowledge and insights,0.76,0.8,No,No,No,2025-08-25T14:28:09.416Z
1949210566750527808,"Perplexity and OpenAI's web search are boring. They always stop where the data gets interesting. They stop at login walls. What is web search if you can't interact with the browser? Browser-use is the only API that can access interesting data behind login walls. We even do","Magnus Müller","mamagnus00·Jul 27",2025-07-26T20:49:48.000Z,https://twitter.com/mamagnus00·Jul 27/status/1949210566750527808,114,9,10,Yes,AI/ML,0.7999999999999999,50,positive,es,"AI; Data Analytics","","",No,No,1,1,standalone,0.5,low,6d7f6103b2d6f623,0.8,0.94,0.7,0.8,Technology,"Content analysis required",general,question,high,AI/ML knowledge and insights,0.765,0.8,No,Yes,No,2025-08-25T14:28:11.364Z
